"pathway","pval","padj","ES","NES","nMoreExtreme","size","leadingEdge","type"
"KEGG_RIBOSOME",0.000195427008012507,0.026668039538715,0.5364025328451,1.87968249723153,0,86,"RPS27 RPS4Y1 RPL21 RPS19 RPLP1 RPS3 RPS2 RPSA RPL23A RPS16 RPL18A RPL37 RPL13A RPS5 RPL28 RPS13 RPS18 RPL30 RPS12 RPL4 RPL27A RPL39 RPL10 RPL3L RPS15A RPS9 RPLP2 RPS6 RPL5 RPS20 RPS11 RPS28 RPL11 FAU RPLP0 RPL19 RPS17 RPS4X RPL29 RPL12 RPS27L RPS25 RPS3A RPL22L1 RPL3 RPL32 RPS27A RPL41 MRPL13 RPL35A UBA52 RPS8 RPL7 RPL17 RPL10A RPS29 RPS23 RPS10 RPL37A RPL35 RPL18 RPL13 RPL27 RPL24 RPL31 RPL6 RPL22 RPL23 RPL26 RPL7A","c2.cp"
"KEGG_CYTOKINE_CYTOKINE_RECEPTOR_INTERACTION",0.000197667523225934,0.026668039538715,0.443373848476346,1.77074194693778,0,227,"CXCL9 TNFRSF8 CXCR1 CXCR2 PRLR IL23R IL1R2 CCR2 TNFRSF17 IFNK CRLF2 CXCR3 IL18RAP IL2RA CXCL6 CCL19 CCR1 TNFSF8 TNFSF11 IL1R1 TNFSF14 INHBB IL22RA1 IL2RG CCL27 CXCL3 BMPR1B IL19 CSF1 TNFRSF10C CSF3R CCR5 CSF2RB IL17RA IL25 CXCR6 CXCL5 LIF CXCL1 EGFR IL7R TNFSF13 NGFR IL21R FAS PLEKHO2 CXCL12 TNFSF10 TNFRSF10D OSMR KDR CD27 CCL5 PF4V1 INHBA IL20RA TNFRSF1A TGFBR2 CCL2 IL7 TNFRSF12A CXCL11 TNFRSF10A XCL2 IL13RA1 CD40LG CCL13 CTF1 IL2RB IL1A IL18R1 BMP7 IL18 CD40 LIFR CNTFR BMP2 IL15 CCL20 TNFSF15 IL15RA IL6R CLCF1 TNFRSF1B CSF3 CCL4 ACVR1 VEGFC IL6ST IL24 TGFB2 CCL3 CXCL16 IL4R LTBR TSLP IL17RB CCR7 CCL4L2 INHBC IL12B TGFBR1 FLT4 TGFB1 CSF2RA CCL3L1 CCL3L3","c2.cp"
"KEGG_SYSTEMIC_LUPUS_ERYTHEMATOSUS",0.000194817845314631,0.026668039538715,0.495905735382227,1.80727581826321,0,111,"CTSG FCGR3B HIST2H3D HIST2H2AB C6 C7 HIST2H4A C3 C4A C4B C1S CD28 H2AFJ FCGR3A TRIM21 C2 C1QB HIST2H3C HIST2H3A C1QC C1R HLA-DOA HIST1H2AK FCGR2A HIST1H2AD HIST1H2AM HLA-DRB1 C5 FCGR2B HIST2H4B CD40LG C1QA ELANE HLA-DRA HLA-DRB5 CD40 HLA-DPA1 HIST1H2BK FCGR1A HLA-DPB1 HIST1H2AB CD86 HLA-DQA1 CD80 HLA-DMA HLA-DQB1 HLA-DMB FCGR2C HIST4H4 HIST2H2AA4 HIST1H3D HIST1H2BC HIST1H2BE ACTN2 HIST1H2AC HIST2H2AC HIST1H2BJ HIST1H4I TNF HIST1H3G","c2.cp"
"REACTOME_INTEGRIN_CELL_SURFACE_INTERACTIONS",0.000197941409342835,0.026668039538715,0.551679655218101,1.88819359254279,0,76,"ITGB7 ITGB3 COL1A1 ITGB4 THBS1 ICAM4 IBSP COL1A2 ICAM1 ICAM3 ITGAV LAMA1 ITGB5 ITGA5 VCAM1 FN1 ITGB8 SPP1 JAM2 ITGB6 TNC ITGAX LAMC1 APBB1IP COL4A1 ITGB2 RASGRP2 LAMB2 SYK ITGB1 PECAM1 ITGAM ITGA1 ICAM2 TLN1 VWF ITGAE ITGA2 RAP1B ITGAL","c2.cp"
"REACTOME_NEURONAL_SYSTEM",0.000201938610662359,0.026668039538715,-0.425084845164207,-1.7232198014622,0,270,"KCNS1 SLC17A7 KCNH5 GNG13 KCNC2 KCNJ6 KCNJ3 GABBR2 NCALD CHRNB3 KCNK9 CHRNA2 STX1A CHRNA6 RASGRF1 HCN1 ADCY1 KCNS2 KCNMB2 KCNV1 GRIN2A KCNAB3 GABRA1 SYT1 CAMK2A RASGRF2 KCNB2 KCNC1 GNG2 KCNC4 NEFL GRIK1 CHRNA4 GABRA3 VAMP1 GRIA4 GABRB2 KCNH3 SNAP25 CACNB3 SYN1 KCNN2 CHRNA7 KCNH1 KCNN1 KCNC3 PANX2 RIMS1 CACNG8 STXBP1 KCNK3 GLS CACNG2 KCNJ9 GRIK3 GNG3 GABRG2 RAB3A ABCC8 KCNA2 SYN2 CHRFAM7A KCNG1 GRIN1 KCNK1 STX1B CAMKK1 GRIP2 KCNH7 KCNJ12 KCNK10 KCNB1 KCNAB2 CAMK2D KCNQ2 GJD2 GABRG3 HCN4 SYN3 KCNG2 GLS2 KCNQ5 CACNB1 PICK1 ADCY6 GRIN2D CACNA1A CACNG3 KCNJ4 HCN3 KCNMB4 KCNV2","c2.cp"
"REACTOME_CLASS_A1_RHODOPSIN_LIKE_RECEPTORS",0.000198059021588433,0.026668039538715,0.38284030180968,1.5513408949768,0,263,"DRD3 PENK DRD2 CXCL9 HTR2C BRS3 CCKAR CXCR1 CXCR2 HTR1D RXFP2 ADORA2A PDYN P2RY1 TRHR KISS1 CCR2 TAC1 HCAR3 EDNRB MTNR1B CXCR3 SST NTSR2 RXFP4 F2RL1 FFAR2 TSHR OXTR HTR1B FPR2 DRD1 P2RY2 TACR1 CXCL6 CCL19 CCR1 OPN4 FPR3 GRPR EDN2 CCL27 CXCL3 AGTR1 LPAR4 C3 NPY HCRT GAST LHCGR PTGER4 CCR5 RLN2 PTGER1 CXCR6 PTGDR HTR4 NTS GNRH1 CXCL5 CXCL1 GALR3 HTR2B TRH PTGER2 PTGFR CXCL12 AGT FPR1 HRH3 NPFFR1 CCL5 HRH4 GPR55 CCL2 HTR6 HEBP1 C5AR1 CXCL11 PTAFR C5 XCL2 EDN1 ADORA2B GPR39","c2.cp"
"REACTOME_INNATE_IMMUNE_SYSTEM",0.000197863078749505,0.026668039538715,0.413015781696527,1.64289865661811,0,220,"DEFA1B DEFA3 UNC93B2 DEFB1 S100A12 DEFA4 DEFA1 CCR2 CR1 DEFB108B TLR4 C6 C7 CD180 C3 C4A TLR8 C1S MASP1 ART1 CFH CTSS TLR5 AIM2 MYD88 C2 C1QB C1QC CASP4 C5 IKBKE RNF135 TLR3 BCL2 SAA1 C1QA TLR1 PELI1 CFI TRIM25 UNC93B1 TNFAIP3 PROS1 TANK NLRC5 PYCARD CD4 CASP1 IRF1 MAPKAPK3 MAPKAPK2 CD14 MAP3K1 PLCG2 TLR2 MAPK7 LY86 CFD TAB2 LY96 HERC5 IRAK4 IRAK3 TXNIP MAPK1 S100B RPS6KA5 BTK NOD1 BIRC3 SIGIRR HSP90B1 MAVS RELA NFKB2 UBE2L6 IFNA2 IRF2 PPP2R1B DDX58 PANX1 CHUK TLR7 FADD CAPZA2 IFIH1 CFB","c2.cp"
"REACTOME_POTASSIUM_CHANNELS",0.000205930807248764,0.026668039538715,-0.526236875027028,-1.87515741555056,0,95,"KCNS1 KCNH5 KCNC2 KCNJ6 KCNJ3 GABBR2 KCNK9 HCN1 KCNS2 KCNMB2 KCNV1 KCNAB3 KCNB2 KCNC1 GNG2 KCNC4 KCNH3 KCNN2 KCNH1 KCNN1 KCNC3 KCNK3 KCNJ9 GNG3 ABCC8 KCNA2 KCNG1 KCNK1 KCNH7 KCNJ12 KCNK10 KCNB1 KCNAB2 KCNQ2 HCN4 KCNG2 KCNQ5 KCNJ4 HCN3 KCNMB4 KCNV2","c2.cp"
"REACTOME_IMMUNOREGULATORY_INTERACTIONS_BETWEEN_A_LYMPHOID_AND_A_NON_LYMPHOID_CELL",0.000397535281256211,0.0420028380295966,0.625844368343037,2.02801738449454,1,55,"CD3E ITGB7 HLA-G SELL C3 ICAM4 ICAM1 ICAM3 FCGR3A VCAM1 LILRB3 LILRB4 LILRB5 HLA-A FCGR2B CD8A CD40LG CD40 HLA-F ITGB2 B2M TYROBP HLA-B HLA-K CD226 ITGB1 CD8B HLA-C CD81 CD160 CD3D ICAM2 LILRB2 LILRA1","c2.cp"
"REACTOME_VOLTAGE_GATED_POTASSIUM_CHANNELS",0.000405432799513481,0.0420028380295966,-0.631843295154704,-1.94085299644645,1,42,"KCNS1 KCNH5 KCNC2 KCNS2 KCNV1 KCNAB3 KCNB2 KCNC1 KCNC4 KCNH3 KCNH1 KCNC3 KCNA2 KCNG1 KCNH7 KCNB1 KCNAB2 KCNQ2 KCNG2 KCNQ5","c2.cp"
"PID_FRA_PATHWAY",0.000600120024004801,0.0478249496053057,0.655018395396237,1.93587924640439,2,35,"MMP9 MGP HMOX1 NFATC2 GJA1 ITGB4 COL1A2 MMP2 LIF THBD CCL2 PLAUR FOSL1 DCN NFATC1","c2.cp"
"PID_SYNDECAN_4_PATHWAY",0.000596421471172962,0.0478249496053057,0.661973334591461,1.90848217834033,2,31,"MMP9 ADAM12 FZD7 THBS1 FGF2 CXCL12 LAMA1 ITGA5 CCL5 FN1 SDC4 TNC SDCBP ITGB1 MDK","c2.cp"
"PID_UPA_UPAR_PATHWAY",0.000592417061611374,0.0478249496053057,0.656764918957346,1.97678705105231,2,38,"CTSG MMP9 ITGB3 FPR2 FPR3 SERPINE1 EGFR MMP3 ITGAV ITGB5 FPR1 ITGA5 FN1 PLAUR ELANE ITGB2 ITGB1 ITGAM LRP1 TGFB1 PLAU DOCK1","c2.cp"
"KEGG_CELL_ADHESION_MOLECULES_CAMS",0.000969743987587277,0.0517482517482517,0.425952368838706,1.58062203928968,4,125,"ITGB7 SELP CDH15 HLA-G PDCD1 SDC2 SIGLEC1 SELL PDCD1LG2 CD2 CD99 ICAM1 ICAM3 ITGAV CD28 VCAM1 ITGB8 JAM2 SDC4 HLA-DOA CDH5 HLA-A HLA-DRB1 CLDN6 CD8A PTPRC CD40LG CLDN23 HLA-DRA HLA-DRB5 CD40 ITGA6 HLA-F ITGB2 CDH4 SELE HLA-DPA1 HLA-DPB1 CD86 HLA-DQA1 CD80 HLA-B HLA-DMA CD4 CD226 SDC3 CD58 ITGB1 PECAM1 PTPRM CD8B CD274 HLA-DQB1 HLA-C HLA-DMB ITGAM MPZL1 ALCAM ICAM2","c2.cp"
"KEGG_ANTIGEN_PROCESSING_AND_PRESENTATION",0.000788643533123028,0.0517482517482517,0.551916774575581,1.84375826045281,3,65,"HLA-G KLRC4 IFI30 HSPA6 HSPA1B CTSS HSPA1A HSPA1L HLA-DOA HLA-A HLA-DRB1 CD8A HLA-DRA HLA-DRB5 CD74 HLA-F B2M HLA-DPA1 HSPA5 HLA-DPB1 HLA-DQA1 HLA-B HLA-DMA CD4 HSP90AA1 CD8B HLA-DQB1 HLA-C HLA-DMB HLA-E HSPA8 LTA TAP1 RFXANK IFNA2 PDIA3 CANX","c2.cp"
"KEGG_HEMATOPOIETIC_CELL_LINEAGE",0.000984445757038787,0.0517482517482517,0.510289468344686,1.75178281179054,4,77,"MME CD3E IL1R2 CR1 CD38 FCER2 IL2RA MS4A1 ITGB3 IL1R1 CD2 CSF1 CSF3R IL7R ITGA5 CD44 HLA-DRB1 IL7 CD8A IL1A CD59 HLA-DRA HLA-DRB5 ITGA6 CD7 ANPEP IL6R FCGR1A CSF3 CD4 CD14 CD8B CR2 IL4R ITGAM CD37 ITGA1 CD3D","c2.cp"
"KEGG_TYPE_I_DIABETES_MELLITUS",0.000993640699523052,0.0517482517482517,0.617662041010563,1.84744376744314,4,37,"HLA-G GAD2 FAS CD28 HLA-DOA HLA-A HLA-DRB1 IL1A HLA-DRA HLA-DRB5 HLA-F CPE HLA-DPA1 HLA-DPB1 CD86 HSPD1 HLA-DQA1 CD80 HLA-B HLA-DMA PRF1 HLA-DQB1 HLA-C HLA-DMB IL12B HLA-E LTA","c2.cp"
"PID_AP1_PATHWAY",0.000985804416403785,0.0517482517482517,0.52639225037751,1.75848987488777,4,65,"PENK TH MMP9 MYB NFATC2 GJA1 FABP4 COL1A2 NTS TIMP1 AGT TP53 CCL2 HLA-A FOSL1 EDN1 TRIP6 MT2A NFATC1 HIF1A ELF1 ETS1","c2.cp"
"REACTOME_DEGRADATION_OF_THE_EXTRACELLULAR_MATRIX",0.000999000999000999,0.0517482517482517,0.670174412508242,1.84004071993259,4,25,"CTSG MMP8 MMP10 MMP9 MMP7 MMP25 MMP2 TIMP1 MMP3 MMP14","c2.cp"
"REACTOME_NEUROTRANSMITTER_RECEPTOR_BINDING_AND_DOWNSTREAM_TRANSMISSION_IN_THE_POSTSYNAPTIC_CELL",0.000821186614658181,0.0517482517482517,-0.438076387044131,-1.63952362247993,3,132,"GNG13 KCNJ6 KCNJ3 GABBR2 NCALD CHRNB3 CHRNA2 CHRNA6 RASGRF1 ADCY1 GRIN2A GABRA1 CAMK2A RASGRF2 GNG2 NEFL GRIK1 CHRNA4 GABRA3 GRIA4 GABRB2 CHRNA7 CACNG8 CACNG2 KCNJ9 GRIK3 GNG3 GABRG2 CHRFAM7A GRIN1 CAMKK1 GRIP2 KCNJ12 CAMK2D GABRG3 PICK1 ADCY6 GRIN2D CACNG3 KCNJ4 GNAI1 GRIK2 GRIN2B AP2A1 CHRNB2 CALM3 GRIA3 ADCY7 GRIA2 AP2A2 CHRNA1 AP2S1 DLG3 GABRB3 AP2M1 NSF GRIA1","c2.cp"
"BIOCARTA_COMP_PATHWAY",0.00137147335423197,0.0572940944104286,0.74497652831181,1.86801943731585,6,17,"C6 C7 C3 C4A C4B C1S MASP1 C2 C1QB C1QC C1R C5 C1QA","c2.cp"
"REACTOME_TRANSLATION",0.00116890707188778,0.0572940944104286,0.405111613775941,1.55109359768702,5,161,"RPL10P9 RPS27 SRP9P1 EEF1A1 RPS4Y1 SEC11C PABPC1 RPL21P16 RPL21 RPL23AP2 SEC61A1 RPS19 EEF1B2 RPLP1 SSR3 RPS15P5 RPS3 EEF1G RPS2 RPL23AP42 RPSA RPL23A RPS16 RPL18A RPL37 RPL13A RPS5 RPL28 TRAM1 RPS13 EIF3E RPS18 RPL30 RPS12 RPL4 SEC11A RPL27A RPN2 RPL39 RPS28P7 RPL10P16 EIF3H RPL10 RPL3L ETF1 EIF4A1 RPS15A RPS9 EIF3FP3 SEC61B RPLP2 RPS6 RPL5 DDOST RPS20 RPS11 RPS28 RPL11 FAU RPLP0 RPL19 RPS17 RPS4X SSR2 EIF4EBP1 EIF3A RPL29 RPL12 RPS25 RPS3A EIF5 EIF3F RPL3 RPL32 EIF5B SSR1 RPS27A RPL41 SPCS2 RPL35A UBA52 RPS14 RPS8 RPL7 EIF4B RPL17 RPL10A RPS29 RPS23 SEC61G EIF2S2 RPS10 RPS19P3 SSR4 RPL37A RPL35 RPL18 SRP54 RPL13 RPL27 EIF4G1 RPL24 RPL31 RPL6 SRP14 RPL22 RPL23 RPL26 EIF3D RPL7A","c2.cp"
"REACTOME_SRP_DEPENDENT_COTRANSLATIONAL_PROTEIN_TARGETING_TO_MEMBRANE",0.0013687915526007,0.0572940944104286,0.430334518806319,1.58916770018499,6,122,"RPL10P9 RPS27 SRP9P1 RPS4Y1 SEC11C RPL21P16 RPL21 RPL23AP2 SEC61A1 RPS19 RPLP1 SSR3 RPS15P5 RPS3 RPS2 RPL23AP42 RPSA RPL23A RPS16 RPL18A RPL37 RPL13A RPS5 RPL28 TRAM1 RPS13 RPS18 RPL30 RPS12 RPL4 SEC11A RPL27A RPN2 RPL39 RPS28P7 RPL10P16 RPL10 RPL3L RPS15A RPS9 SEC61B RPLP2 RPS6 RPL5 DDOST RPS20 RPS11 RPS28 RPL11 FAU RPLP0 RPL19 RPS17 RPS4X SSR2 RPL29 RPL12 RPS25 RPS3A RPL3 RPL32 SSR1 RPS27A RPL41 SPCS2 RPL35A UBA52 RPS14 RPS8 RPL7 RPL17 RPL10A RPS29 RPS23 SEC61G RPS10 RPS19P3 SSR4 RPL37A RPL35 RPL18 SRP54 RPL13 RPL27 RPL24 RPL31 RPL6 SRP14 RPL22 RPL23 RPL26 RPL7A","c2.cp"
"REACTOME_GLUTAMATE_NEUROTRANSMITTER_RELEASE_CYCLE",0.00122324159021407,0.0572940944104286,-0.760693527118054,-1.85183080899994,5,15,"SLC17A7 STX1A SYT1 SNAP25 RIMS1 STXBP1 GLS RAB3A","c2.cp"
"REACTOME_CYTOKINE_SIGNALING_IN_IMMUNE_SYSTEM",0.00138257949832115,0.0572940944104286,0.373797945623414,1.50528160879848,6,247,"PRLR IL1R2 IL2RA HLA-G IL1R1 CISH IL2RG SOCS3 CSF2RB GBP2 IL7R ICAM1 IL1RN MYD88 VCAM1 CD44 HLA-A HLA-DRB1 IL7 PTAFR IFI35 IL2RB SOCS1 MT2A IL1A IFITM3 IL18 HLA-DRB5 LCK HLA-F PELI1 GBP1 HCK YES1 B2M HLA-DPA1 IL6R TRIM25 VAV1 FCGR1A LYN RNASEL HLA-DPB1 HLA-DQA1 HLA-B HLA-K CASP1 STAT3 SYK IRF1 PSMB8 STAT5A IL6ST NUP37 HLA-C IRF6 USP18 TAB2 SP100 IRF5 HERC5 IRAK4 IFIT3 PTPN6 IRAK3 MAPK1 FYN NOD1 CSF2RA FLNB RAPGEF1 GBP5 NEDD4 RELA FCGR1B NFKB2 UBE2L6 IFNAR2 IFNA2 IRF2 XAF1 DDX58 IFNGR1 TNIP2 CHUK PRL","c2.cp"
"KEGG_ALLOGRAFT_REJECTION",0.00159045725646123,0.0610264339886606,0.637059334951532,1.8366546260518,7,31,"HLA-G FAS CD28 HLA-DOA HLA-A HLA-DRB1 CD40LG HLA-DRA HLA-DRB5 CD40 HLA-F HLA-DPA1 HLA-DPB1 CD86 HLA-DQA1 CD80 HLA-B HLA-DMA PRF1 HLA-DQB1 HLA-C HLA-DMB IL12B HLA-E","c2.cp"
"REACTOME_GPCR_DOWNSTREAM_SIGNALING",0.00156862745098039,0.0610264339886606,0.318680162388166,1.36519016081387,7,483,"DRD3 DGKK PENK DRD2 CXCL9 HTR2C BRS3 CCKAR CXCR1 CXCR2 RGS8 GLP1R HTR1D RXFP2 ADORA2A PDYN P2RY1 RGS9 OR51E1 OR2F1 TRHR KISS1 CCR2 GNG7 OR2A1 TAC1 PRKCH HCAR3 EDNRB MTNR1B PDE10A CXCR3 OR2A14 SST NTSR2 RXFP4 TRPC7 F2RL1 GNAT2 FFAR2 TSHR GNAL OXTR HTR1B FPR2 DGKH DRD1 P2RY2 TACR1 CXCL6 CCL19 CCR1 RGS20 OPN4 FPR3 GRPR EDN2 CCL27 PDE7B CXCL3 OBSCN AGTR1 LPAR4 ADM PDE1B C3 NPY HCRT GAST LHCGR PTGER4 CCR5 RLN2 OR4F16 OR4F29 PTGER1 CXCR6 TRPC3 ADCY5 PDE3A CALCA PTGDR HTR4 NTS GNRH1 CXCL5 CXCL1 GALR3 HTR2B TRH PTGER2 PIK3R6 PTGFR GNG12 CXCL12 AGT FPR1 HRH3 NPFFR1 RAC2 CCL5 HRH4 GPR55 HTR6 HEBP1 GNA12 C5AR1 GNG5 RHOC CXCL11 PTAFR C5 CALCRL DGKB XCL2 OR3A3 EDN1 RGS2 ADORA2B","c2.cp"
"REACTOME_CELL_SURFACE_INTERACTIONS_AT_THE_VASCULAR_WALL",0.0017650519709747,0.0630549600665445,0.47409061592765,1.65181310190316,8,84,"SELP CD48 ITGB3 COL1A1 SLC7A10 SELL CD2 COL1A2 ANGPT2 ATP1B2 ITGAV ITGA5 FCER1G PF4V1 TREM1 THBD FN1 CAV1 JAM2 SLC7A11 SLC7A7 DOK2 MERTK ITGAX LCK ITGB2 YES1 PROS1 LYN CD58 ITGB1 SLC16A3 PECAM1 SLC16A8 SLC3A2 ITGAM PTPN6 FYN","c2.cp"
"REACTOME_3_UTR_MEDIATED_TRANSLATIONAL_REGULATION",0.00176159718144451,0.0630549600665445,0.429459103448573,1.58216373216248,8,120,"RPL10P9 RPS27 RPS4Y1 PABPC1 RPL21P16 RPL21 RPL23AP2 RPS19 RPLP1 RPS15P5 RPS3 RPS2 RPL23AP42 RPSA RPL23A RPS16 RPL18A RPL37 RPL13A RPS5 RPL28 RPS13 EIF3E RPS18 RPL30 RPS12 RPL4 RPL27A RPL39 RPS28P7 RPL10P16 EIF3H RPL10 RPL3L EIF4A1 RPS15A RPS9 EIF3FP3 RPLP2 RPS6 RPL5 RPS20 RPS11 RPS28 RPL11 FAU RPLP0 RPL19 RPS17 RPS4X EIF3A RPL29 RPL12 RPS25 RPS3A EIF3F RPL3 RPL32 RPS27A RPL41 RPL35A UBA52 RPS14 RPS8 RPL7 EIF4B RPL17 RPL10A RPS29 RPS23 EIF2S2 RPS10 RPS19P3 RPL37A RPL35 RPL18 RPL13 RPL27 EIF4G1 RPL24 RPL31 RPL6 RPL22 RPL23 RPL26 EIF3D RPL7A","c2.cp"
"REACTOME_FORMATION_OF_THE_TERNARY_COMPLEX_AND_SUBSEQUENTLY_THE_43S_COMPLEX",0.002,0.0668387096774194,0.533510733264629,1.71564088646089,9,53,"RPS27 RPS4Y1 RPS19 RPS15P5 RPS3 RPS2 RPSA RPS16 RPS5 RPS13 EIF3E RPS18 RPS12 RPS28P7 EIF3H RPS15A RPS9 EIF3FP3 RPS6 RPS20 RPS11 RPS28 FAU RPS17 RPS4X EIF3A RPS25 RPS3A EIF3F RPS27A RPS14 RPS8 RPS29 RPS23 EIF2S2 RPS10 RPS19P3","c2.cp"
"REACTOME_ACTIVATION_OF_THE_MRNA_UPON_BINDING_OF_THE_CAP_BINDING_COMPLEX_AND_EIFS_AND_SUBSEQUENT_BINDING_TO_43S",0.00199560965875075,0.0668387096774194,0.514251790101362,1.69333932888784,9,61,"RPS27 RPS4Y1 PABPC1 RPS19 RPS15P5 RPS3 RPS2 RPSA RPS16 RPS5 RPS13 EIF3E RPS18 RPS12 RPS28P7 EIF3H EIF4A1 RPS15A RPS9 EIF3FP3 RPS6 RPS20 RPS11 RPS28 FAU RPS17 RPS4X EIF4EBP1 EIF3A RPS25 RPS3A EIF3F RPS27A RPS14 RPS8 EIF4B RPS29 RPS23 EIF2S2 RPS10 RPS19P3","c2.cp"
"KEGG_COMPLEMENT_AND_COAGULATION_CASCADES",0.00218210672485618,0.0686820472023336,0.509005403850008,1.68180059676842,10,62,"SERPIND1 CR1 SERPINA5 SERPINE1 C6 C7 C3 C4A C4B F3 C1S MASP1 CFH THBD C2 C1QB C1QC C1R C5AR1 PLAUR C5 F13A1 C1QA CD59 SERPINA1 CFI A2M PROS1 SERPING1 CR2 CFD C3AR1 VWF SERPINC1 PLAU PLAT","c2.cp"
"KEGG_GRAFT_VERSUS_HOST_DISEASE",0.00218774860779634,0.0686820472023336,0.6274658792265,1.79742566875575,10,30,"HLA-G FAS CD28 HLA-DOA HLA-A HLA-DRB1 IL1A HLA-DRA HLA-DRB5 HLA-F HLA-DPA1 HLA-DPB1 CD86 HLA-DQA1 CD80 HLA-B HLA-DMA PRF1 HLA-DQB1 HLA-C HLA-DMB HLA-E","c2.cp"
"KEGG_LEISHMANIA_INFECTION",0.00256056726413236,0.0780219907541508,0.49923001686139,1.68101288881627,12,68,"FCGR3B CR1 TLR4 C3 NCF2 FCGR3A MYD88 NCF4 HLA-DOA FCGR2A HLA-DRB1 IL1A CYBA HLA-DRA HLA-DRB5 ITGB2 HLA-DPA1 FCGR1A HLA-DPB1 HLA-DQA1 HLA-DMA ITGB1 TLR2 HLA-DQB1 TGFB2 TAB2 HLA-DMB FCGR2C ITGAM IRAK4 PTPN6 MAPK1 IL12B TGFB1","c2.cp"
"REACTOME_INTERFERON_GAMMA_SIGNALING",0.00297560007934934,0.0880777623487403,0.511729093644914,1.67756910183724,14,59,"HLA-G SOCS3 GBP2 ICAM1 VCAM1 CD44 HLA-A HLA-DRB1 PTAFR SOCS1 MT2A HLA-DRB5 HLA-F GBP1 B2M HLA-DPA1 FCGR1A HLA-DPB1 HLA-DQA1 HLA-B HLA-K IRF1 HLA-C IRF6 SP100 IRF5 PTPN6 GBP5 FCGR1B IRF2 IFNGR1","c2.cp"
"REACTOME_PD1_SIGNALING",0.00313479623824451,0.0902124695228144,0.711755948362525,1.78471924367781,15,17,"CD3E PDCD1 PDCD1LG2 HLA-DRB1 HLA-DRB5 LCK HLA-DPA1 HLA-DPB1 HLA-DQA1 CD4 CD274 CD3D PTPN6","c2.cp"
"REACTOME_HEMOSTASIS",0.00331384015594542,0.0927875243664717,0.315059930793329,1.33827802633773,16,430,"DGKK GATA3 GATA6 P2RY1 HIST2H3D GNG7 PRKCH MYB NFE2 PDE10A SELP CD48 TRPC7 GATA4 NOS1 ITGB3 DGKH COL1A1 MRVI1 SERPINE1 SLC7A10 SELL LEFTY2 CD2 H3F3AP6 HBB PDE1B THBS1 PLEK TRPC3 PDE3A COL1A2 F3 TIMP1 SPARC CABLES1 KLC3 ANGPT2 ATP1B2 ITGAV PIK3R6 GNG12 PDE9A DOCK4 ITGA5 RAC2 FCER1G PF4V1 TREM1 TP53 ALB THBD FN1 CAV1 HIST2H3C HIST2H3A JAM2 SLC7A11 GNA12 PLAUR GNG5 F13A1 DGKB SLC7A7 DOK2 MERTK ITGAX ITPR2 APOA1 ATP2A3 APBB1IP P2RX1 LCK WEE1 ITGB2 ARRB1 SERPINA1 YES1 CLU HSPA5 AK3 PIK3R5 A2M SRGN RASGRP2 VAV1 PROS1 SERPING1 LYN ADRA2B PPP2R5A SYK CD58 IRF1 ITGB1 PRKG1 VEGFC SLC16A3 KIF4B PECAM1 ORAI1 VCL PLCG2 SLC16A8 GNA14 CALU TGFB2 GNA13 CFD LCP2 SLC3A2 MAFF MMRN1 ITGAM HDAC1 PTPN6 TLN1 CAP1 MAPK1 VWF FYN GATA2 PDE5A FGR SERPINC1 RHOB PDE6A HIST1H3D TGFB1 PLAU NOS3 CD36 EHD2 PLAT KCNMB1 DOCK1 GNG4 ACTN2 ABCC4 PSAP IFNA2 RHOG IRF2 RACGAP1 PPP2R1B ITGA2 RAP1B DGKD ITGAL PRCP PRKCA HIST1H3G GNGT2 GP5 GNG11 CAPZA2 AKAP1 NRAS DOCK2 RHOA PDE6G","c2.cp"
"REACTOME_PEPTIDE_CHAIN_ELONGATION",0.00349922239502333,0.0953998526643202,0.438467875577255,1.5686814929325,17,99,"RPL10P9 RPS27 EEF1A1 RPS4Y1 RPL21P16 RPL21 RPL23AP2 RPS19 RPLP1 RPS15P5 RPS3 RPS2 RPL23AP42 RPSA RPL23A RPS16 RPL18A RPL37 RPL13A RPS5 RPL28 RPS13 RPS18 RPL30 RPS12 RPL4 RPL27A RPL39 RPS28P7 RPL10P16 RPL10 RPL3L RPS15A RPS9 RPLP2 RPS6 RPL5 RPS20 RPS11 RPS28 RPL11 FAU RPLP0 RPL19 RPS17 RPS4X RPL29 RPL12 RPS25 RPS3A RPL3 RPL32 RPS27A RPL41 RPL35A UBA52 RPS14 RPS8 RPL7 RPL17 RPL10A RPS29 RPS23 RPS10 RPS19P3 RPL37A RPL35 RPL18 RPL13 RPL27 RPL24 RPL31 RPL6 RPL22 RPL23 RPL26 RPL7A","c2.cp"
"PID_IL4_2PATHWAY",0.00379165835162642,0.10072200134064,0.499901754050724,1.64608722226763,18,61,"TFF3 MYB SELP FCER2 IL13RA2 ITGB3 COL1A1 IL2RG SOCS3 PIGR COL1A2 ARG1 IL13RA1 CD40LG DOK2 SOCS1 IGHG1 ETS1 SPI1 IGHG3 ALOX15 STAT5A IL4R PTPN6 LTA PARP14 BCL6 SP1","c2.cp"
"REACTOME_COMPLEMENT_CASCADE",0.00419078028337657,0.108541209339453,0.630962664424638,1.75263747921328,20,26,"CR1 C6 C7 C3 C4A C1S MASP1 CFH C2 C1QB C1QC C5 C1QA CFI PROS1 CFD","c2.cp"
"KEGG_O_GLYCAN_BIOSYNTHESIS",0.00463149416028997,0.109050635228646,-0.615639681068938,-1.72928258635273,22,27,"GALNT9 GALNTL5 GALNT14 GALNT8 WBSCR17 GALNT5 GCNT4 GALNT12 GALNT6 B3GNT6","c2.cp"
"KEGG_ECM_RECEPTOR_INTERACTION",0.00451068837026868,0.109050635228646,0.451968584756104,1.57473614719827,22,84,"LAMC2 SV2C ITGB7 COL3A1 ITGB3 COL1A1 SDC2 ITGB4 THBS1 IBSP COL1A2 ITGAV LAMA1 ITGB5 ITGA5 FN1 ITGB8 COMP SPP1 SDC4 CD44 ITGB6 HSPG2 TNC LAMC1 COL4A6 THBS4 COL6A3 ITGA6 COL4A1 LAMA4 LAMB2 SDC3 RELN ITGB1 ITGA1 DAG1 CHAD VWF","c2.cp"
"REACTOME_ANTIGEN_PROCESSING_CROSS_PRESENTATION",0.00454905063291139,0.109050635228646,0.476314353983997,1.61846547774834,22,72,"HLA-G MRC2 NCF2 ITGAV ITGB5 CTSS NCF4 HLA-A CYBA HLA-F B2M FCGR1A HLA-B HLA-K PSMB8 HLA-C SEC61A1 CD36 PSMB9 TAP1 FCGR1B PDIA3 MRC1 PSMB10 CALR SEC61B CYBB","c2.cp"
"REACTOME_INFLUENZA_VIRAL_RNA_TRANSCRIPTION_AND_REPLICATION",0.0045071526553008,0.109050635228646,0.417215109335216,1.52766595829809,22,115,"RPL10P9 RPS27 RPS4Y1 HSP90AA1 RPL21P16 RPL21 RPL23AP2 DNAJC3 RPS19 RPLP1 RPS15P5 RPS3 RPS2 RPL23AP42 RPSA RPL23A RPS16 RPL18A RPL37 RPL13A RPS5 RPL28 RPS13 RPS18 RPL30 RPS12 RPL4 RPL27A RPL39 RPS28P7 RPL10P16 RPL10 RPL3L RPS15A RPS9 GTF2F2 RPLP2 RPS6 RPL5 RPS20 RPS11 RPS28 RPL11 FAU POLR2J RPLP0 RPL19 RPS17 RPS4X RPL29 RPL12 RPS25 RPS3A RPL3 RPL32 POLR2G RPS27A RPL41 RPL35A UBA52 RPS14 RPS8 RPL7 RPL17 RPL10A RPS29 RPS23 RPS10 RPS19P3 RPL37A RPL35 RPL18 POLR2L RPL13 RPL27 RPL24 RPL31 RPL6 RPL22 RPL23 RPL26 RPL7A POLR2A","c2.cp"
"REACTOME_TRANSMISSION_ACROSS_CHEMICAL_SYNAPSES",0.00490998363338789,0.109208051880149,-0.369052443382874,-1.43516312840258,23,181,"SLC17A7 GNG13 KCNJ6 KCNJ3 GABBR2 NCALD CHRNB3 CHRNA2 STX1A CHRNA6 RASGRF1 ADCY1 GRIN2A GABRA1 SYT1 CAMK2A RASGRF2 GNG2 NEFL GRIK1 CHRNA4 GABRA3 GRIA4 GABRB2 SNAP25 CACNB3 SYN1 CHRNA7 RIMS1 CACNG8 STXBP1 GLS CACNG2 KCNJ9 GRIK3 GNG3 GABRG2 RAB3A SYN2 CHRFAM7A GRIN1 CAMKK1 GRIP2 KCNJ12 CAMK2D GABRG3 SYN3 GLS2 CACNB1 PICK1 ADCY6 GRIN2D CACNA1A CACNG3","c2.cp"
"REACTOME_GPCR_LIGAND_BINDING",0.00495441934205311,0.109208051880149,0.325337500777029,1.35722791790894,24,353,"DRD3 PENK DRD2 CXCL9 HTR2C BRS3 WNT3A CCKAR CXCR1 CXCR2 GLP1R HTR1D RXFP2 ADORA2A PDYN P2RY1 WNT6 TRHR KISS1 CCR2 GNG7 TAC1 HCAR3 EDNRB MTNR1B CXCR3 SST NTSR2 RXFP4 F2RL1 FZD7 FFAR2 TSHR OXTR HTR1B FPR2 DRD1 P2RY2 TACR1 CXCL6 CCL19 CCR1 OPN4 FPR3 GRPR EDN2 CCL27 CXCL3 AGTR1 LPAR4 ADM GRM4 C3 NPY HCRT GAST LHCGR PTGER4 CCR5 RLN2 PTGER1 CXCR6 CALCA PTGDR HTR4 NTS GNRH1 CXCL5 CXCL1 GALR3 HTR2B TRH FZD2 PTGER2 PTGFR GNG12 CXCL12 AGT TAS1R1 FPR1 HRH3 NPFFR1 CCL5 HRH4 GPR55 CCL2 HTR6 HEBP1 C5AR1 GNG5 CXCL11 PTAFR C5 CALCRL XCL2 EDN1 SMO ADORA2B GPR39","c2.cp"
"NABA_CORE_MATRISOME",0.00476758045292014,0.109208051880149,0.343121715918416,1.38794707872725,23,259,"AMBN COCH LAMC2 TECTB ESM1 COL17A1 COL6A5 EFEMP1 EGFLAM ABI3BP WISP3 MFAP4 MGP ASPN SPON1 SMOC2 MFAP2 IGFBPL1 COL3A1 OGN COL1A1 COL25A1 RSPO4 COL14A1 PODNL1 FBLN5 COL8A1 FBN2 THBS1 IMPG1 NPNT IBSP CTGF COL1A2 FBLN1 SPARC FMOD SRPX2 WISP2 LRG1 LAMA1 NTN3 FGL2 EMILIN1 LTBP1 VWA3B VWDE VWA5A FN1 COMP SPP1 NID1 AEBP1 IGFBP7 NTN1 ZP3 SRPX HSPG2 PAPLN LTBP2 TNC PODN LAMC1 COL4A6 BGN FNDC7 THBS4 COL6A3 DCN FBLN2 COL8A2 FGL1 CRIM1 TSKU COL4A1 OMD LAMA4 ECM2 SRGN LAMB2 MFAP5 ZP1 PRELP RELN COL9A1","c2.cp"
"PID_INTEGRIN3_PATHWAY",0.00514342235410485,0.111012199142763,0.549488951086231,1.68232760370643,25,41,"ITGB3 COL1A1 THBS1 IBSP COL1A2 ITGAV KDR FN1 SPP1 TGFBR2 SDC4 PLAUR TNC LAMC1 COL4A6 SPHK1 COL4A1 LAMA4 PECAM1","c2.cp"
"SA_MMP_CYTOKINE_CONNECTION",0.00627820286443006,0.132739146276521,0.712062278252148,1.72711648040592,31,15,"TNFRSF8 TNFSF8 SELL CSF1 FCGR3A TNFRSF1A CD44 ACE IL6R TNFRSF1B TGFB2 TGFB1","c2.cp"
"REACTOME_SMOOTH_MUSCLE_CONTRACTION",0.007,0.14504,0.632719157614522,1.70653001864907,34,23,"MYH11 ACTG2 ACTA2 LMOD1 MYL9 ITGB5 SORBS1 MYLK VCL SORBS3 ITGA1 TLN1","c2.cp"
"KEGG_PPAR_SIGNALING_PATHWAY",0.00883565678382093,0.153970418139406,0.464804487990734,1.55736496233069,44,66,"SLC27A6 APOA2 LPL FABP4 RXRG PLIN1 CYP7A1 PLTP FABP6 ACOX2 PPARA FADS2 CPT2 SORBS1 EHHADH CYP8B1 APOA1 ME1 CPT1A ANGPTL4 PCK2 FABP5 ACOX1 APOA5 CYP27A1 ACADL ACSL1 CD36","c2.cp"
"KEGG_AUTOIMMUNE_THYROID_DISEASE",0.00832672482157018,0.153970418139406,0.541289140962289,1.63769989039731,41,39,"TSHR HLA-G FAS CD28 HLA-DOA HLA-A HLA-DRB1 CD40LG HLA-DRA HLA-DRB5 CD40 HLA-F HLA-DPA1 HLA-DPB1 CD86 HLA-DQA1 CD80 HLA-B HLA-DMA PRF1 HLA-DQB1 HLA-C HLA-DMB","c2.cp"
"BIOCARTA_INFLAM_PATHWAY",0.00831189392440135,0.153970418139406,0.640195224338358,1.69291653076088,41,21,"CSF1 HLA-DRB1 IL7 IL1A HLA-DRA IL15 CSF3 CD4 TGFB2 IL12B TGFB1 LTA TNF TGFB3 IL12A","c2.cp"
"BIOCARTA_NDKDYNAMIN_PATHWAY",0.0089086859688196,0.153970418139406,-0.663738655073681,-1.69184864990155,43,18,"AMPH DNM1 SYNJ2 SYNJ1 PPP3CB AP2A1 NME1 CALM3 EPS15 AP2M1 BIN1 PPP3CC CALM1 CALM2","c2.cp"
"PID_INTEGRIN1_PATHWAY",0.00833664152441445,0.153970418139406,0.470387768023617,1.56525157646607,41,64,"LAMC2 COL3A1 COL1A1 THBS1 NPNT COL1A2 ITGAV LAMA1 ITGA5 VCAM1 FN1 SPP1 JAM2 NID1 PLAUR F13A1 TNC LAMC1 COL4A6 COL6A3 ITGA6 COL4A1 LAMA4 LAMB2 ITGB1 CD14 MDK CD81 ITGA1 PLAU TGM2 TGFBI CSPG4 ITGA2","c2.cp"
"PID_IL23_PATHWAY",0.00902346099859635,0.153970418139406,0.567420221719772,1.65560222075665,44,33,"CXCL9 CD3E IL23R IL18RAP SOCS3 IL19 CXCL1 CCL2 IL18R1 IL18 MPO CD4 STAT3 STAT5A IL24","c2.cp"
"REACTOME_EXTRACELLULAR_MATRIX_ORGANIZATION",0.00903910394969542,0.153970418139406,0.442351172443851,1.52455660704995,45,79,"CTSG MMP8 MMP10 MMP9 COL17A1 MMP7 COL3A1 COL1A1 COL25A1 COL14A1 MMP25 COL8A1 COL1A2 MMP2 TIMP1 MMP3 MMP14 SERPINH1 COL4A6 ELANE COL6A3 PLOD2 COL8A2 COL4A1","c2.cp"
"REACTOME_PEPTIDE_LIGAND_BINDING_RECEPTORS",0.00858369098712446,0.153970418139406,0.369526579748555,1.41514133425754,43,162,"PENK CXCL9 BRS3 CCKAR CXCR1 CXCR2 RXFP2 PDYN TRHR KISS1 CCR2 TAC1 EDNRB CXCR3 SST NTSR2 RXFP4 F2RL1 OXTR FPR2 TACR1 CXCL6 CCL19 CCR1 FPR3 GRPR EDN2 CCL27 CXCL3 AGTR1 C3 NPY HCRT GAST CCR5 RLN2 CXCR6 NTS CXCL5 CXCL1 GALR3 TRH CXCL12 AGT FPR1 NPFFR1 CCL5 CCL2 HEBP1 C5AR1 CXCL11 C5 XCL2 EDN1","c2.cp"
"REACTOME_CHEMOKINE_RECEPTORS_BIND_CHEMOKINES",0.00861393891934221,0.153970418139406,0.508027427336914,1.60151308431403,43,47,"CXCL9 CXCR1 CXCR2 CCR2 CXCR3 CXCL6 CCL19 CCR1 CCL27 CXCL3 CCR5 CXCR6 CXCL5 CXCL1 CXCL12 CCL5 CCL2 CXCL11 XCL2","c2.cp"
"REACTOME_INFLUENZA_LIFE_CYCLE",0.00779119594857811,0.153970418139406,0.379027995324479,1.43644652877359,39,148,"RPL10P9 HSPA1B RPS27 RPS4Y1 HSP90AA1 RPL21P16 RPL21 RPL23AP2 NUP37 DNAJC3 RPS19 RPLP1 RPS15P5 RPS3 RPS2 RPL23AP42 RPSA RPL23A RPS16 RPL18A RPL37 RPL13A RPS5 RPL28 RPS13 RPS18 CANX RPL30 RPS12 RPL4 RPL27A RPL39 RPS28P7 RPL10P16 RPL10 RPL3L RPS15A RPS9 GTF2F2 CALR RPLP2 RPS6 RPL5 RPS20 RPS11 RPS28 RPL11 FAU POLR2J TPR RPLP0 RPL19 RPS17 NUP35 RPS4X RPL29 RPL12 RPS25 RPS3A RPL3 RPL32 POLR2G RPS27A RPL41 RPL35A UBA52 RPS14 RPS8 RPL7 RPL17 RPL10A RPS29 RPS23 RPS10 NUP188 RPS19P3 RPL37A RPL35 RPL18 POLR2L XPO1 RPL13 RPL27 RPL24 RPL31 NUP153 RPL6 RPL22 RPL23 RPL26 NUP205 RPL7A POLR2A NUP210 NUP43 KPNB1 RPL14","c2.cp"
"NABA_ECM_REGULATORS",0.00906582577847852,0.153970418139406,0.351304182717913,1.38554680023392,45,204,"CTSG MMP8 MMP10 MMP9 SERPIND1 MMP7 MMP19 SERPINA5 ADAMTS12 ADAM12 MEP1A SERPINI2 SERPINA3 ADAMDEC1 HPSE2 SERPINE1 MMP25 HTRA3 CSTA TGM5 LOXL1 ADAMTS20 CELA1 CST7 MMP2 FAM20A TIMP3 TIMP1 MMP3 AGT MMP14 SERPINH1 MASP1 ITIH2 CD109 CTSS ADAMTS9 PAMR1 CST3 TGM4 SERPINB1 MMP28 F13A1 TIMP4 CTSO CTSL P4HA1 CST6 LOXL4 PCSK5 ELANE AMBP PLOD2 HTRA1 SULF1 CPN2 SERPINA1 A2M ADAM8 SERPING1 CTSZ LOXL2 HYAL4 A2ML1 CTSW ADAMTSL4 SERPINA11","c2.cp"
"BIOCARTA_CREB_PATHWAY",0.00921658986175115,0.154006243496358,-0.593727741095506,-1.65367627001724,45,26,"ADCY1 CAMK2A PRKAR1B GNAS PIK3R1 CAMK2G CAMK2D","c2.cp"
"REACTOME_NONSENSE_MEDIATED_DECAY_ENHANCED_BY_THE_EXON_JUNCTION_COMPLEX",0.00939518496770405,0.154498597246689,0.397975294266962,1.46617471100198,47,120,"RPL10P9 RPS27 RPS4Y1 PABPC1 RPL21P16 RPL21 RPL23AP2 RPS19 RPLP1 RPS15P5 RPS3 RPS2 RPL23AP42 RPSA RPL23A RPS16 RPL18A RPL37 RPL13A RPS5 RPL28 RPS13 RPS18 RPL30 RPS12 RPL4 RPL27A RPL39 RPS28P7 RPL10P16 RPL10 RPL3L ETF1 RPS15A RPS9 RPLP2 RPS6 RPL5 RPS20 RPS11 RPS28 NCBP2 RPL11 FAU RPLP0 RPL19 RPS17 NCBP1 RPS4X RPL29 RPL12 RPS25 RPS3A RPL3 RPL32 RPS27A RPL41 RPL35A UBA52 RPS14 RPS8 RPL7 RPL17 RPL10A RPS29 RPS23 RPS10 RPS19P3 RBM8A RPL37A RPL35 RPL18 RPL13 RPL27 EIF4G1 RPL24 RPL31 SMG1 RPL6 RPL22 RPL23 RPL26 RPL7A","c2.cp"
