"pathway","pval","padj","ES","NES","nMoreExtreme","size","leadingEdge","type"
"PID_INTEGRIN2_PATHWAY",0.372120730738682,0.969529824561404,0.376472995929262,1.05769003247766,1873,27,"C3 ICAM4 ICAM1 ICAM3 VCAM1 FCGR2A PLAUR CD40LG ITGAX ITGB2 ITGAM ICAM2 PLAU PLAT TGFBI ITGAL F10 PROC F11R GP1BA","c2.cp"
"PID_P38_MK2_PATHWAY",0.370670888581041,0.969529824561404,0.402920515724052,1.06547311776171,1872,21,"TH SFN HSPB1 LSP1 MAPKAPK3 MAPKAPK2 ETV1","c2.cp"
"PID_LYMPH_ANGIOGENESIS_PATHWAY",0.373181908746762,0.969529824561404,0.387993589607229,1.05756483114456,1872,24,"COL1A1 COL1A2 ITGA5 FN1 ITGB1 VEGFC ITGA1 MAPK1 FLT4 ITGA2","c2.cp"
"NABA_ECM_AFFILIATED",0.3700061462815,0.969529824561404,-0.270661018231221,-1.03133795868727,1805,152,"FREM3 ANXA8 C1QL3 SFTPA1 MUC5B MUCL1 SFTPA2 SEMA7A PLXNA1 SEMA3C LMAN1L MUC19 FREM1 CLEC2L CLEC4G SEMA5B COLEC10 SEMA4F LGALS9C SDC1 ELFN2 MUC5AC C1QL2 CLEC4C ANXA8L1 CLEC1B","c2.cp"
"KEGG_DRUG_METABOLISM_CYTOCHROME_P450",0.377347301838308,0.977072458375139,0.326215691631073,1.04356387305417,1908,51,"FMO2 MGST1 GSTM1 ADH1B FMO1 UGT1A7 GSTM2 ADH1C GSTM5 MAOB CYP2C19 FMO4 ALDH3B1","c2.cp"
"REACTOME_DOWNREGULATION_OF_TGF_BETA_RECEPTOR_SIGNALING",0.378191173560261,0.977072458375139,0.400298032731396,1.05853828813299,1910,21,"TGFBR2 PMEPA1 PPP1R15A TGFBR1 TGFB1 SMURF2 PPP1CC PPP1CA RPS27A UBA52 PPP1CB XPO1","c2.cp"
"BIOCARTA_MPR_PATHWAY",0.382152861144458,0.983415989027475,-0.358526575663619,-1.04448403082877,1909,32,"ADCY1 PRKAR1B GNAS CDK1 PIN1 GNAI1 CDC25C","c2.cp"
"REACTOME_ACYL_CHAIN_REMODELLING_OF_PC",0.382545022758757,0.983415989027475,0.399001565489334,1.05510994199382,1932,21,"PLA2G5 PLBD1 PLA2G2A PNPLA8 PLA2G4D LPCAT3 PLA2G2D PLA2G12A PLA2G10 PLA2G4F PLA2G16 PLA2G1B LPCAT2","c2.cp"
"REACTOME_SULFUR_AMINO_ACID_METABOLISM",0.383741781231321,0.984050706325863,0.383599197302493,1.04558691480722,1925,24,"MAT1A SQRDL TST GCLC ADI1 CBS GCLM ETHE1","c2.cp"
"REACTOME_FRS2_MEDIATED_CASCADE",0.387154861944778,0.985485103132162,-0.357058615669821,-1.04020746982746,1934,32,"FGF8 FGF5 FGF17 FGF9 FGF18 CDK1 FRS3 FGFR4","c2.cp"
"REACTOME_MITOTIC_G2_G2_M_PHASES",0.386072083078803,0.985485103132162,-0.2992306826713,-1.0339620579397,1895,78,"NEK2 TUBA4A CDK1 YWHAG PKMYT1 TUBB4B PRKACA TUBG1 CDC25C CSNK1E CLASP1 FGFR1OP E2F1 TUBB4A CENPJ TUBG2 CEP290 TUBB TUBGCP6 DYNLL1 DYNC1H1 CCNB1 CEP63","c2.cp"
"REACTOME_ASPARAGINE_N_LINKED_GLYCOSYLATION",0.387014515496273,0.985485103132162,0.298441487711224,1.03153542041073,1972,80,"MAN1A1 ST8SIA6 MGAT2 MLEC B4GALT1 ST6GAL1 ST8SIA2 MGAT4C B4GALT4 PDIA3 CANX EDEM2 PMM2 RPN2 LMAN1 MANEA CALR ALG14 DDOST ALG10 SEC13 STT3A ALG8 DPM3 DOLK MGAT1 MGAT4A PGM3 DAD1 ALG11 UGGT1 ALG9 ALG5 TUSC3 MPI PMM1 FUT8 GANAB MCFD2 SAR1B DPM2 EDEM1 SEC23A EDEM3 SEC24B","c2.cp"
"KEGG_CITRATE_CYCLE_TCA_CYCLE",0.392125671107576,0.98706669369552,0.365191959525625,1.04074216706445,1971,29,"SDHD SUCLG2 IDH2 PCK2 ACO1 PC PCK1 IDH1 SDHC DLAT DLST DLD FH","c2.cp"
"KEGG_CHEMOKINE_SIGNALING_PATHWAY",0.39878144654088,0.98706669369552,0.263035492795679,1.0160636224969,2028,175,"CXCL9 CXCR1 CXCR2 CCR2 GNG7 CXCR3 CXCL6 CCL19 CCR1 ITK CCL27 PARD3 CXCL3 CCR5 CXCR6 ADCY5 CXCL5 CXCL1 GNG12 CXCL12 RAC2 CCL5 PF4V1 CCL2 GNG5 CXCL11 XCL2 CCL13 ARRB1 CCL20 HCK PIK3R5 RASGRP2 VAV1 LYN ADCY3 CCL4 STAT3 CCL3 GRK7 CXCL16 SOS2 CCR7 MAPK1 CCL4L2 FGR CCL3L1 CCL3L3 PRKX GNG4 ROCK1 WAS RELA CCR3 RAP1B CHUK GNGT2 GNG11 NFKB1 NRAS DOCK2 RHOA PXN VAV3","c2.cp"
"KEGG_HEDGEHOG_SIGNALING_PATHWAY",0.393559928443649,0.98706669369552,0.317669875223712,1.02939334772567,1979,55,"WNT3A WNT6 CSNK1A1L GLI2 GLI3 BMP6 SMO WNT1 BMP7 WNT8A WNT11 BMP2 GAS1 PTCH1 GLI1 SUFU","c2.cp"
"KEGG_VASOPRESSIN_REGULATED_WATER_REABSORPTION",0.400162173119805,0.98706669369552,-0.335883750964615,-1.03174472138338,1973,42,"CREB3L3 AQP3 AVPR2 CREB3L1 GNAS DYNC1I1 ADCY6 PRKACA VAMP2 DYNC1LI1 NSF DYNLL1 DYNC1H1 PRKACB","c2.cp"
"BIOCARTA_IL6_PATHWAY",0.393583100836987,0.98706669369552,0.391327845656059,1.04500030933051,1974,22,"IL6R STAT3 IL6ST SHC1 CEBPB HRAS PTPN11 JUN JAK1 FOS RAF1 SOS1 JAK3","c2.cp"
"SA_TRKA_RECEPTOR",0.39576802507837,0.98706669369552,0.419459272629025,1.05178894187312,2019,17,"NTRK1 NGFR CDKN1A","c2.cp"
"PID_GMCSF_PATHWAY",0.399279855971194,0.98706669369552,0.350319230821213,1.03535371423102,1995,35,"CISH CSF2RB CCL2 LYN STAT3 SYK STAT5A PIM1 MAPK1 CSF2RA NRAS SHC1 STAT5B HRAS PTPN11 OSM FOS RAF1 GAB2 SOS1 STAT1 IKBKB","c2.cp"
"PID_WNT_SIGNALING_PATHWAY",0.395626242544732,0.98706669369552,0.367487252205699,1.03943128114161,1989,28,"WNT3A FZD7 WIF1 KREMEN1 FZD2 LRP5 WNT1 FZD5","c2.cp"
"PID_BMP_PATHWAY",0.393371473663444,0.98706669369552,0.335804078432321,1.03334943387953,1993,42,"CER1 NOG BMPR1B BMP6 SMAD6 SMAD1 BAMBI BMP7 BMP2 CTDSP2 CTDSP1 CHRDL1 TAB2 PPP1R15A MAPK1 RGMA BMPR1A SMURF2","c2.cp"
"REACTOME_ENOS_ACTIVATION_AND_REGULATION",0.398814229249012,0.98706669369552,0.398695475555479,1.03986309876848,2017,20,"DHFRP1 CAV1 GCH1 HSP90AA1 NOS3 SPR LYPLA1","c2.cp"
"REACTOME_TIE2_SIGNALING",0.396896692527562,0.98706669369552,-0.417150866661049,-1.04427221033547,1943,17,"GRB14 GRB7 PIK3R1 ANGPT4","c2.cp"
"REACTOME_MAPK_TARGETS_NUCLEAR_EVENTS_MEDIATED_BY_MAP_KINASES",0.389022919179735,0.98706669369552,-0.36220494284737,-1.04272265542599,1934,30,"MEF2C MAPK8 MAPK11 MAPK9 MAPK10 DUSP7 DUSP6 PPP2CA ATF2 DUSP3","c2.cp"
"REACTOME_DESTABILIZATION_OF_MRNA_BY_KSRP",0.395467537770519,0.98706669369552,-0.417702656675749,-1.04565353067865,1936,17,"MAPK11 DCP2 EXOSC9 EXOSC6 YWHAZ EXOSC3 EXOSC8 PARN EXOSC1 EXOSC2 KHSRP EXOSC5 MAPK14 AKT1 DIS3 EXOSC4 EXOSC7","c2.cp"
"KEGG_LINOLEIC_ACID_METABOLISM",0.402855993563958,0.991031510546031,-0.366131888608009,-1.03806057189301,2002,28,"PLA2G12B CYP2C18 CYP3A4 PLA2G2E PLA2G2C CYP2E1 PLA2G4B JMJD7-PLA2G4B CYP3A7","c2.cp"
"BIOCARTA_NOS1_PATHWAY",0.403682719546742,0.991031510546031,-0.395142510199175,-1.03462368187568,1994,20,"GRIN2A PRKAR1B GRIN1 GRIN2D PPP3CB GRIN2B CALM3","c2.cp"
"KEGG_OOCYTE_MEIOSIS",0.407551816129694,0.99180155560227,-0.280606473385556,-1.01661967654272,1985,106,"ADCY1 CAMK2A YWHAH PTTG2 CDK1 YWHAG CAMK2G CPEB1 PKMYT1 SMC1B CAMK2D IGF1 ADCY6 PPP3CB CDC20 CALML6 REC8 PRKACA ITPR1 CALML3 CALM3 PPP3R2 ADCY7 CDC25C PPP2CA ANAPC4 MAPK12 YWHAB ANAPC2 PTTG1 CCNB1 PPP3R1 PRKACB YWHAQ PPP3CC CCNE2 CUL1 CALM1 CALM2 ANAPC5","c2.cp"
"BIOCARTA_CDMAC_PATHWAY",0.407575458670349,0.99180155560227,0.425355396813932,1.0470925798525,2065,16,"MAPK1 RELA PRKCA TNF NFKB1 MYC HRAS JUN FOS CUZD1 RAF1","c2.cp"
"BIOCARTA_IGF1_PATHWAY",0.407759143261265,0.99180155560227,-0.390666899201248,-1.03184497762196,2017,21,"MAPK8 PIK3R1 IGF1 RASA1 IRS1","c2.cp"
"REACTOME_REGULATION_OF_INSULIN_SECRETION_BY_GLUCAGON_LIKE_PEPTIDE1",0.407825736183945,0.99180155560227,-0.338876084932397,-1.02433389041995,2021,39,"GNG13 KCNC2 GNG2 PRKAR1B GNAS GNG3 KCNB1 KCNG2 ADCY6","c2.cp"
"KEGG_FRUCTOSE_AND_MANNOSE_METABOLISM",0.998997393222378,1,0.16598982944297,0.484320296897208,4981,33,"HK3 FBP1 HK2 ALDOC PMM2 GMDS FPGT AKR1B1 MPI PMM1 PHPT1 PFKFB3 FUK PFKFB4 SORD PFKM MTMR1","c2.cp"
"KEGG_PURINE_METABOLISM",0.997070884592853,1,0.178165093340364,0.677297908698533,5105,152,"PDE10A NT5C1B PDE7B NT5E PDE1B GMPR ADCY5 PDE3A PDE9A ENTPD3 PNP GUCY2C NPR1 RRM2 AMPD1 AK7 ADK PDE4B ADCY3 ATIC PDE5A PDE6A NT5C2 AK4 ADSSL1 PAPSS2 AMPD2","c2.cp"
"KEGG_PYRIMIDINE_METABOLISM",0.99358101536666,1,0.184488972104299,0.657072441593259,5107,96,"NT5C1B NT5E ENTPD3 PNP RRM2 TXNRD1 TK1 AK3 CMPK2 UPB1 NT5C2 UMPS CTPS2 TYMP CDA DHODH ENTPD5 POLR2J NME6 DCK POLR1E CANT1 POLR2G POLR3B POLR1B POLD4 NUDT2 POLR2L DCTD TK2 ENTPD1 POLA1 POLR3GL TYMS POLR2A ENTPD6 POLR1A NME2","c2.cp"
"KEGG_SELENOAMINO_ACID_METABOLISM",0.441029734583915,1,0.361699515485793,1.00469990190584,2209,26,"MAT1A AHCYL1 AHCYL2 CBS PAPSS2","c2.cp"
"KEGG_N_GLYCAN_BIOSYNTHESIS",0.97203072680717,1,0.208510974987615,0.653559801307487,4934,46,"MAN1A1 MGAT2 B4GALT1 ST6GAL1 RPN2 ALG14 DDOST ALG10 STT3A ALG8 DPM3 MGAT1 MGAT4A DAD1 ALG11 ALG9 ALG5 TUSC3 FUT8 GANAB DPM2","c2.cp"
"KEGG_OTHER_GLYCAN_DEGRADATION",0.850892681969786,1,0.291810794545821,0.707790944434729,4336,15,"FUCA2 HEXB GBA GLB1 AGA MANBA HEXA MAN2B1 NEU1 FUCA1 NEU3 ENGASE","c2.cp"
"KEGG_AMINO_SUGAR_AND_NUCLEOTIDE_SUGAR_METABOLISM",0.700986193293886,1,0.279716976149171,0.864584029082507,3553,43,"HK3 NPL RENBP PGM1 PGM2 HK2 CYB5R3 UGDH HEXB PMM2 GMDS CYB5R1 FPGT PGM3 GALK2 MPI PMM1 NANP","c2.cp"
"KEGG_GLYCOSAMINOGLYCAN_DEGRADATION",0.655928853754941,1,0.331320506959595,0.864138145968515,3318,20,"HPSE2 HYAL4 GNS NAGLU HYAL2 HEXB GLB1 SGSH ARSB","c2.cp"
"KEGG_GLYCOSAMINOGLYCAN_BIOSYNTHESIS_CHONDROITIN_SULFATE",0.509764846552411,1,0.359394386599434,0.959725328358432,2557,22,"CHST14 CHST7 DSE CHST11 UST CHSY1 CHST3 CHST15","c2.cp"
"KEGG_GLYCEROLIPID_METABOLISM",0.494845360824742,1,0.321779069160875,0.973560166679253,2495,39,"LPL DGKH GPAM DGAT2 ALDH7A1 DGKB ALDH2 ALDH9A1","c2.cp"
"KEGG_INOSITOL_PHOSPHATE_METABOLISM",0.456417433026789,1,-0.307459160505842,-0.991978165563171,2282,53,"PIK3C2G PIP5K1B PIP5K1C INPP5J PIP4K2C SYNJ2 ITPKA PI4KA PIK3CD MIOX SYNJ1","c2.cp"
"KEGG_GLYCOSYLPHOSPHATIDYLINOSITOL_GPI_ANCHOR_BIOSYNTHESIS",0.98819291574945,1,-0.193568994889267,-0.534025370633959,4937,25,"PIGQ GPLD1 PIGZ PIGG PIGU PIGL PIGH PIGP PIGT PIGX PIGW GPAA1 PIGS PIGK PIGB PIGC DPM2 PIGA PIGV PIGF PIGO PIGN PIGM PGAP1 PIGY","c2.cp"
"KEGG_GLYCEROPHOSPHOLIPID_METABOLISM",0.809861932938856,1,0.244478229958093,0.826741758668974,4105,70,"CHAT PLA2G5 DGKH GPAM","c2.cp"
"KEGG_ETHER_LIPID_METABOLISM",0.913734164488237,1,-0.243570616885944,-0.69654409285639,4543,29,"PLA2G12B PLA2G2E PLA2G2C PLA2G4B JMJD7-PLA2G4B","c2.cp"
"KEGG_ARACHIDONIC_ACID_METABOLISM",0.648360490846912,1,-0.276594399373245,-0.897897911482916,3222,55,"CYP4F2 PLA2G12B CYP2C18 ALOX15B PLA2G2E PLA2G2C PTGES CYP2E1 PLA2G4B PTGS2 GGT7 JMJD7-PLA2G4B","c2.cp"
"KEGG_ALPHA_LINOLENIC_ACID_METABOLISM",0.812917594654788,1,-0.297546059932668,-0.758435411185638,4014,18,"PLA2G12B PLA2G2E PLA2G2C PLA2G4B JMJD7-PLA2G4B","c2.cp"
"KEGG_SPHINGOLIPID_METABOLISM",0.936635251654301,1,0.230876194696134,0.677884178156617,4670,34,"SPHK1 KDSR DEGS2 ACER2 SGMS1 SGPP2 SMPD3 ASAH1 SGMS2 GBA GLB1 SPTLC1","c2.cp"
"KEGG_GLYCOSPHINGOLIPID_BIOSYNTHESIS_LACTO_AND_NEOLACTO_SERIES",0.919632147141143,1,-0.248579580938765,-0.672502686688255,4599,23,"FUT1 B3GALT2 ST3GAL6 B3GNT4 ST8SIA1 ST3GAL4 B4GALT2 FUT7 FUT2","c2.cp"
"KEGG_PYRUVATE_METABOLISM",0.696090047393365,1,0.286470673745811,0.862243859288298,3524,38,"LDHC ALDH7A1 ALDH2 ALDH9A1 ME1 ACSS1 PCK2 LDHAL6B ACACB PC ALDH3A2 ME2 PCK1 ACOT12 LDHD AKR1B1 ACAT1 LDHB","c2.cp"
"KEGG_BUTANOATE_METABOLISM",0.572741806554756,1,0.319872992329401,0.92801163203542,2865,32,"ACSM5 GAD2 ALDH7A1 EHHADH ALDH2 ALDH9A1 BDH2 HADHA HADH ALDH5A1 ACADS ALDH3A2","c2.cp"
"KEGG_RIBOFLAVIN_METABOLISM",0.699546261590057,1,0.336227826132879,0.827688244984652,3545,16,"ACP5 PHPT1 MTMR1 TYR FLAD1 ACP6 MTMR6 ACP2 RFK ACP1 ENPP3 ENPP1 MTMR7 ACPP MTMR2 ACPT","c2.cp"
"KEGG_AMINOACYL_TRNA_BIOSYNTHESIS",0.992482690405539,1,0.186924650528469,0.572292670809086,5016,41,"PARS2 DARS LARS2 DARS2 WARS TARS KARS EARS2 WARS2 EPRS TARSL2 IARS FARS2 RARS2 SEPSECS IARS2 HARS2 LARS NARS2 YARS QARS CARS NARS MARS2 RARS MTFMT YARS2 VARS VARS2 PSTK SARS FARSB GARS AARS CARS2 FARSA MARS TARS2 HARS AARS2 SARS2","c2.cp"
"KEGG_METABOLISM_OF_XENOBIOTICS_BY_CYTOCHROME_P450",0.540657609765702,1,0.299657714748548,0.95157950165873,2745,49,"MGST1 GSTM1 AKR1C3 EPHX1 ADH1B CYP1B1 UGT1A7 GSTM2 ADH1C GSTM5 CYP2C19 ALDH3B1","c2.cp"
"KEGG_DRUG_METABOLISM_OTHER_ENZYMES",0.816498993963783,1,-0.265359058758269,-0.793649563242184,4057,37,"UGT2B15 CYP3A4 DPYS HPRT1 CYP2A7 CES5A CYP2A6 CYP3A7 UGT2B7 UCKL1 TPMT UGT1A1","c2.cp"
"KEGG_BIOSYNTHESIS_OF_UNSATURATED_FATTY_ACIDS",0.631818181818182,1,0.336661940224659,0.878069478746083,3196,20,"FADS2 ELOVL2 HADHA ACOX1 HSD17B12 PECR ELOVL5","c2.cp"
"KEGG_ABC_TRANSPORTERS",0.428977850030482,1,-0.325207542756383,-1.01075487879029,2110,44,"ABCC12 ABCG8 ABCG4 ABCC3 ABCB11 ABCC8 ABCA10 ABCA7 ABCG5 ABCC10 ABCA5 ABCB5 ABCA2 ABCA9 ABCA8","c2.cp"
"KEGG_RNA_DEGRADATION",0.999801626661377,1,0.146530768902725,0.476496038138166,5039,56,"PAPOLB HSPD1 ENO1 XRN2 PATL1 CNOT6 CNOT1 PAPOLA CNOT6L EXOSC7 DCP1A DCP1B EDC3 LSM2 HSPA9 WDR61 EXOSC4 LSM7 DIS3 LSM6 LSM3 ENO3 ZCCHC7 EXOSC5 NAA38 XRN1 LSM5 DDX6 CNOT10 LSM1 CNOT2 EXOSC2 EXOSC10 CNOT4 EXOSC1 PARN EXOSC8 SKIV2L2 CNOT3 EXOSC3 CNOT7 C1D CNOT8 EDC4 MPHOSPH6 PAPOLG DCPS EXOSC6 LSM4 TTC37 SKIV2L EXOSC9 PNPT1 ENO2 PAPD7 DCP2","c2.cp"
"KEGG_RNA_POLYMERASE",0.701186406595616,1,-0.297239734196626,-0.850022813358534,3486,29,"POLR3A POLR2J2 POLR2K POLR3F ZNRD1 POLR3G POLR3K POLR2E POLR2B POLR2F POLR1C POLR1D POLR2C POLR2D POLR3D POLR2H POLR2J3 POLR2I POLR3H POLR3C POLR1A POLR2A POLR3GL POLR2L POLR1B POLR3B POLR2G POLR1E POLR2J","c2.cp"
"KEGG_BASAL_TRANSCRIPTION_FACTORS",0.974415350789526,1,-0.212068574258151,-0.628313888320813,4874,35,"TAF1L TBPL1 TBPL2 TAF4B TAF13 TAF6 TAF5 TAF9 TAF11 TBP TAF12 GTF2A1L GTF2F1 GTF2H2 TAF6L TAF7 TAF9B GTF2B GTF2H1 TAF4 GTF2IRD1 TAF7L GTF2H4 GTF2E1 GTF2E2 GTF2H3 GTF2A1 TAF10 TAF5L GTF2A2 TAF1 TAF2 GTF2I","c2.cp"
"KEGG_DNA_REPLICATION",0.999800876144962,1,0.125484681920832,0.373119737951175,5020,36,"RPA4 RNASEH1 MCM3 RPA3 RNASEH2A MCM7 MCM5 POLD4 POLA1 RPA1 RFC1 RPA2 SSBP1 POLD2 POLE4 POLD3 PRIM1 PRIM2 POLD1 PCNA POLE3 RNASEH2B RFC2 MCM4 LIG1 RFC4 MCM6 POLA2 MCM2 RFC3 RNASEH2C RFC5 DNA2 POLE POLE2 FEN1","c2.cp"
"KEGG_SPLICEOSOME",1,1,0.158638711903164,0.587106493857371,5135,123,"HSPA6 HSPA1B HSPA1A HSPA1L HSPA8 PPIL1 MAGOHB NCBP2 CRNKL1 RBMX NCBP1 SNRPG AQR SNRPA PLRG1 PRPF40A HNRNPC SYF2 RBM8A USP39 HNRNPK SF3A1 DDX5 SRSF6 SF3B5 PRPF38A SNRPD3 DHX16 SNRPF BUD31 DHX15 WBP11 SF3A3 SNRNP200 PRPF3 SNRPD2 DHX8 THOC2 ZMAT2 HNRNPM PRPF18 LSM2 HNRNPA1 HSPA2 RBM17 SNRNP27 SF3B4 LSM7 DDX23 SNRNP40 PRPF6 SF3B2 RBM22 LSM6 LSM3 PUF60 PRPF38B SRSF3 SNW1 DDX42 CWC15 SNRPC CTNNBL1 PHF5A NAA38 DDX39B HNRNPU","c2.cp"
"KEGG_PROTEASOME",0.771552574472283,1,0.267868559007799,0.824295598484289,3910,42,"PSMB11 PSMB8 PSMB9 PSMB10 PSME1 PSME3 PSMB1 PSMA2 PSME4 PSMA5 PSMD2 PSMA3 PSMC3 PSMA7 PSMF1 PSMD1 PSMC2 PSMA6 PSMB5 PSMB6 PSME2 PSMB2 PSMB3 PSMB7 PSMD6 PSMA1 PSMD7 PSMA8 PSMD14 PSMC4 POMP PSMC1 PSMD8 PSMB4 PSMC5 PSMD4 PSMD3 PSMC6 PSMD13 PSMD11 PSMD12 PSMA4","c2.cp"
"KEGG_PROTEIN_EXPORT",0.5842,1,0.338062659455257,0.911801183197641,2920,23,"SRP9P1 HSPA5 SEC11C SEC61A1 SEC11A SEC61B IMMP2L SPCS2 SEC61G SRP54 SRP14 SRP72 SEC62","c2.cp"
"KEGG_BASE_EXCISION_REPAIR",0.511465603190429,1,-0.326585375777343,-0.962727003473849,2564,34,"NEIL3 FEN1 POLE2 POLE NEIL1 PARP2","c2.cp"
"KEGG_NUCLEOTIDE_EXCISION_REPAIR",1,1,-0.13898176839933,-0.431959539689268,4920,44,"POLE2 POLE DDB2 RFC5 RFC3 ERCC3 RAD23B RBX1 CCNH RAD23A RFC4 ERCC2 LIG1 RFC2 MNAT1 ERCC5 GTF2H2 ERCC1 POLE3 PCNA POLD1 GTF2H1 DDB1 XPA POLD3 XPC CDK7 POLE4 POLD2 GTF2H4 ERCC8 GTF2H3 CETN2 CUL4A RPA2 RFC1 ERCC6 RPA1 POLD4 ERCC4 CUL4B RPA3 GTF2H5","c2.cp"
"KEGG_MISMATCH_REPAIR",0.9452,1,0.238261494579579,0.642623805356566,4725,23,"RPA4 RPA3 MSH3 MLH1 POLD4 RPA1 RFC1 RPA2 SSBP1","c2.cp"
"KEGG_HOMOLOGOUS_RECOMBINATION",0.775294352424666,1,0.288106177799571,0.800278231462174,3884,26,"RPA4 BRCA2 RAD54L NBN RAD54B RAD51B RPA3 POLD4 RPA1 RAD51 XRCC2 RPA2 SSBP1","c2.cp"
"KEGG_MAPK_SIGNALING_PATHWAY",0.839756592292089,1,-0.218063502953638,-0.879235163015819,4139,256,"BDNF MEF2C CACNA1G RASGRF1 PLA2G12B STMN1 FGF8 FGF5 RASGRF2 PAK1 FGF17 NLK RAC3 CACNB3 FGF9 CACNG6 CACNA1I FGF12 CACNG8 PLA2G2E CACNG2 FGF18 PLA2G2C MAPK8 MAP2K4 CACNA1F CACNG7 MAPK13 PTPRR FGFR4 PLA2G4B MAPK11 MAP4K2 NGF CACNB1 MAPK8IP2 MAPK8IP3 CACNA1C CACNA1A CACNG3 DUSP2 MAPK9 JMJD7-PLA2G4B PPP3CB FGF10 CACNA2D1 CACNA1D MAPK10 RAPGEF2 PRKACA RASA1 AKT3 MAPT FGF16 DUSP7 CACNA1B CACNB2 PPP3R2 DUSP6","c2.cp"
"KEGG_PHOSPHATIDYLINOSITOL_SIGNALING_SYSTEM",0.678701825557809,1,-0.260699430748825,-0.892085584806977,3345,74,"PIK3C2G DGKZ PIP5K1B PIP5K1C PIK3R1 INPP5J PIP4K2C SYNJ2 ITPKA PI4KA PIK3CD SYNJ1 CALML6 ITPR1 CALML3 CALM3 INPP5E","c2.cp"
"KEGG_CELL_CYCLE",1,1,0.155179157226161,0.574844427666397,5141,124,"WEE2 ESPL1 BUB1 CDC14A SFN TP53 CDKN2B CDKN1A WEE1 GADD45A TGFB2 HDAC1 CDK4 TGFB1 TFDP1 SMC3 CDC14B CDC25A E2F2 CDKN2A GADD45B CHEK1 BUB1B MCM3 ABL1 MYC TGFB3","c2.cp"
"KEGG_P53_SIGNALING_PATHWAY",0.957785195366189,1,0.211896106011974,0.709975010318609,4877,66,"SERPINE1 THBS1 SFN FAS TP53 RRM2 SESN3 CDKN1A CD82 GADD45A PERP CDK4 SERPINB5 CDKN2A GADD45B CHEK1 GTSE1 CASP3 SESN2 TNFRSF10B CDK2 STEAP3 CASP8 CDK6 CCNB2","c2.cp"
"KEGG_UBIQUITIN_MEDIATED_PROTEOLYSIS",0.982546201232033,1,-0.195814143393029,-0.73211714075395,4784,131,"UBE2U UBE2QL1 FBXW7 CBLC UBE2E2 UBE2O CDC20 CDC34 TRIM37 UBE2K PRPF19 PPIL2 ANAPC4 DDB2 HERC1 ANAPC2 SAE1 STUB1 RHOBTB2 UBE2W UBE2M UBE2N UBE2S UBA1 CUL1 SIAH1 UBE2D4 ANAPC5 UBE2E3 UBE2Z AIRE PIAS3 RBX1 PIAS2 CUL7","c2.cp"
"KEGG_REGULATION_OF_AUTOPHAGY",0.664860525787678,1,-0.317274599965493,-0.867153606952534,3312,24,"IFNA13 ULK3 PRKAA2 ATG5 ATG4B ATG4D GABARAPL1 IFNA21 ATG12","c2.cp"
"KEGG_LYSOSOME",0.729935559461043,1,0.241078382296145,0.887924073326028,3737,119,"CTSG ACP5 PSAPL1 DNASE2B CD68 CTSS NPC2 CTSO GM2A LAPTM5 CTSZ CTSW TPP1 GNS CTSC CLN5 SLC11A1 AP3B1 SUMF1 LAMP3 NAGLU PSAP NAGA LAPTM4A AP1S3 DNASE2 ASAH1 HEXB AP1S2 GBA IGF2R GLB1 TCIRG1 SGSH CTSD CLN3","c2.cp"
"KEGG_ENDOCYTOSIS",0.829382957884427,1,0.224560983422667,0.868520541437251,4233,176,"CXCR1 CXCR2 NTRK1 IL2RA HLA-G IL2RG PARD3 FGFR3 CCR5 ACAP1 EGFR HSPA6 KDR HSPA1B DAB2 HSPA1A CHMP4C HSPA1L HLA-A IL2RB PSD4 HLA-F ARRB1 RAB31 HLA-B SH3GLB1 PSD2 HLA-C GRK7 ASAP3 CHMP3 HLA-E ADRB2 EHD2 HSPA8 NEDD4 RAB5C ASAP2 CBLB ERBB4 PLD2 SMURF2 WWP1 ARFGAP3 ACAP2 CHMP4A FGFR2 F2R GRK5 EHD4 CSF1R","c2.cp"
"KEGG_PEROXISOME",0.94067963072088,1,0.215778313244115,0.742654649993766,4788,78,"DDO PIPOX ACOX2 ECI2 EHHADH EPHX2 ABCD1 IDH2 AGXT CAT ACOX1 PEX11G SOD2 ABCD3 ACSL1 PECR PEX11A DHRS4 PEX7 XDH ACSL5 PEX10 PEX12 PEX2 IDH1 PXMP2 SCP2 ABCD2 PRDX1 HMGCL ECH1 PMVK PXMP4","c2.cp"
"KEGG_MTOR_SIGNALING_PATHWAY",0.980710659898477,1,-0.200887753101025,-0.638526473526644,4829,50,"EIF4E1B PIK3R1 IGF1 PIK3CD ULK3 PRKAA2 AKT3","c2.cp"
"KEGG_VASCULAR_SMOOTH_MUSCLE_CONTRACTION",0.877295818679172,1,0.223669080302168,0.815992832335685,4489,112,"ADORA2A PRKCH MYH11 PLA2G5 MRVI1 ACTG2 AGTR1 ACTA2 MYL9 ADCY5 CACNA1S PLA2G2A MYLK GNA12 NPR1 CALCRL ADORA2B ITPR2 PLA2G4E RAMP1 ADCY3 PRKG1 RAMP2 GNA13","c2.cp"
"KEGG_DORSO_VENTRAL_AXIS_FORMATION",0.907352062163778,1,0.254441204859189,0.693537411598808,4553,24,"PIWIL3 PIWIL2 EGFR NOTCH2 ETS1 NOTCH1 SOS2 MAPK1 PIWIL4","c2.cp"
"KEGG_NOTCH_SIGNALING_PATHWAY",0.67443226311668,1,0.278870983039999,0.879116961293286,3444,47,"PTCRA LFNG MAML2 NOTCH2 DTX3L KAT2B NOTCH1 JAG1 DLL3 HDAC1 DTX2 APH1A PSENEN NOTCH3 EP300","c2.cp"
"KEGG_VEGF_SIGNALING_PATHWAY",0.985212933753943,1,0.196192775894228,0.669702351237058,4996,74,"PLA2G5 NFATC2 KDR RAC2 PLA2G2A HSPB1 SPHK1 CHP2 NFATC4 NFATC1 PLA2G4E PIK3R5 MAPKAPK3 MAPKAPK2 PLCG2 SH2D2A","c2.cp"
"KEGG_TIGHT_JUNCTION",0.977188655980271,1,-0.198877865287231,-0.735548405289823,4754,123,"CLDN4 MYH13 CLDN16 MYH1 PRKCE CLDN20 EPB41L3 MYH7B TJP3 ACTN3 MYL7 CLDN3 MAGI1 CRB3 MYL10","c2.cp"
"KEGG_GAP_JUNCTION",0.933255269320843,1,0.21692971830451,0.76343259238863,4781,88,"DRD2 HTR2C DRD1 GJA1 ADCY5 EGFR HTR2B TUBB1 TUBA1C TUBB2B","c2.cp"
"KEGG_RIG_I_LIKE_RECEPTOR_SIGNALING_PATHWAY",0.735229321049469,1,-0.259813144730625,-0.858697824450505,3670,60,"IFNE CXCL10 IFNW1 IFNA13 TBKBP1 MAPK8 MAPK13 MAPK11 PIN1 MAPK9 MAPK10 TRAF3 RNF125 ATG5 MAPK12 IKBKG","c2.cp"
"KEGG_CYTOSOLIC_DNA_SENSING_PATHWAY",0.624384479023045,1,0.289587127121247,0.907686059565018,3169,46,"IL33 TMEM173 CCL5 AIM2 IKBKE IL18 PYCARD CCL4 CASP1 CCL4L2 MAVS RELA IFNA2 DDX58 CHUK NFKB1 RIPK3 IL1B IRF7 NFKBIB POLR3B RIPK1 ZBP1","c2.cp"
"KEGG_T_CELL_RECEPTOR_SIGNALING_PATHWAY",0.435649312947552,1,0.279454863390804,1.00598220618475,2250,102,"CD3E PDCD1 ITK NFATC2 CD28 MAP3K14 CD8A PTPRC CD40LG CHP2 NFATC4 NFATC1 LCK PIK3R5 VAV1 CD4 CD8B LCP2 CD3D PTPN6 SOS2 MAPK1 FYN CDK4 RELA CBLB NFATC3 CHUK TNF NFKB1 NRAS PAK2 RHOA NCK1 VAV3 PAK4","c2.cp"
"KEGG_B_CELL_RECEPTOR_SIGNALING_PATHWAY",0.48186119873817,1,0.286866612347715,0.979216711242461,2443,74,"NFATC2 PIK3AP1 RAC2 LILRB3 FCGR2B CHP2 NFATC4 NFATC1 CD79B PIK3R5 VAV1 LYN SYK PLCG2 CR2 CD81 PTPN6 SOS2 MAPK1 BTK RELA NFATC3 CHUK NFKB1 NRAS VAV3","c2.cp"
"KEGG_FC_EPSILON_RI_SIGNALING_PATHWAY",0.471425666056539,1,-0.288493334424908,-0.989304985488725,2317,75,"PLA2G12B FCER1A PRKCE RAC3 PLA2G2E PLA2G2C MAPK8 MAP2K4 PIK3R1 MAPK13 PLA2G4B MAPK11 PIK3CD MAPK9 JMJD7-PLA2G4B MAPK10 AKT3","c2.cp"
"KEGG_FC_GAMMA_R_MEDIATED_PHAGOCYTOSIS",0.874343512935227,1,0.227945172940979,0.807916204283829,4494,93,"SCIN LIMK2 MYO10 RAC2 FCGR3A FCGR2A FCGR2B PTPRC SPHK1 PLA2G4E WASF2 HCK PIK3R5 VAV1 FCGR1A LYN SYK VASP PLCG2 WASF3 FCGR2C ASAP3 MAPK1 GSN WAS ASAP2 PLA2G4D PLD2 PRKCA ARPC1B DOCK2 VAV3","c2.cp"
"KEGG_NEUROTROPHIN_SIGNALING_PATHWAY",0.93657937806874,1,-0.213464026560202,-0.789004834198525,4577,122,"BDNF CAMK2A YWHAH TP73 SHC3 YWHAG MAPK8 PIK3R1 CAMK2G MAPK13 CAMK2D MAPK11 PIK3CD NGF MAPK9 SHC2 CALML6 MAPK10 AKT3 IRS1 SORT1 CALML3 CALM3 GSK3B","c2.cp"
"KEGG_LONG_TERM_DEPRESSION",0.452004860267315,1,-0.294410752460165,-0.995132858772852,2231,69,"CRHR1 PLA2G12B PRKG2 GRM1 GNAS PLA2G2E CRH PLA2G2C GNAZ PPP1R17 PLA2G4B IGF1 CACNA1A JMJD7-PLA2G4B GNAI1 ITPR1 GRIA3 GRIA2 PPP2CA GRM5 PLCB4","c2.cp"
"KEGG_REGULATION_OF_ACTIN_CYTOSKELETON",0.908677604269619,1,0.211286289888547,0.832564151728107,4596,203,"INSRR ITGB7 ITGB3 ITGB4 FGFR3 MYL9 FGF2 SCIN LIMK2 EGFR ITGAV GNG12 MSN ITGB5 DIAPH3 ITGA5 RAC2 FGF11 FN1 ITGB8 MYLK GNA12 FGF1 ITGB6 ITGAX IQGAP2 MYL12A ITGA6 EZR WASF2 ITGB2 ARHGEF6 PIK3R5 VAV1 DIAPH2 ITGB1 CD14 VCL GNA13 PFN4 ITGAM MYLPF ITGA1 TMSB4Y SOS2 MAPK1 CHRM4 GSN ITGAE DOCK1 MRAS ROCK1 WAS ACTN2 IQGAP1 NCKAP1L ITGA2 ITGAL RRAS2 PDGFC ARPC1B ARAF NRAS PAK2 RHOA PXN VAV3 FGFR2 F2R PAK4","c2.cp"
"KEGG_INSULIN_SIGNALING_PATHWAY",0.704930812707075,1,0.241387857932273,0.900636390035932,3616,132,"PRKAG3 PHKA1 FOXO1 SOCS3 HK3 PHKG1 PDE3A PYGL PPP1R3B SLC2A4 G6PC SORBS1 FBP1 PPP1R3C PYGM SOCS1 G6PC2 PIK3R5 PCK2 PPP1R3D HK2 RHOQ ACACB SOS2 MAPK1 TRIP10 PRKX RAPGEF1 PRKAG2 SREBF1 CBLB PCK1 ARAF NRAS RPS6 SHC1 IRS4 PPP1CC EIF4EBP1 PRKAA1 SHC4 PTPN1 HRAS PPP1CA","c2.cp"
"KEGG_PROGESTERONE_MEDIATED_OOCYTE_MATURATION",0.628722970216238,1,-0.263441405028887,-0.921133689012881,3081,83,"ADCY1 CDK1 MAPK8 PIK3R1 MAPK13 CPEB1 PKMYT1 MAPK11 IGF1 PIK3CD ADCY6 MAPK9 MAPK10 PRKACA GNAI1 AKT3 CCNB3 ADCY7 CDC25C ANAPC4 MAPK12 ANAPC2","c2.cp"
"KEGG_MELANOGENESIS",0.843557019349527,1,-0.230415277828795,-0.827259501148194,4097,99,"TYRP1 WNT2 ADCY1 CREB3L3 CAMK2A WNT9A WNT9B CREB3L1 WNT3 GNAS WNT8B CAMK2G CAMK2D ADCY6 WNT7A CALML6 PRKACA GNAI1 CALML3 CALM3 GSK3B ADCY7","c2.cp"
"KEGG_TYPE_II_DIABETES_MELLITUS",0.627921154236944,1,-0.29046384123553,-0.902770403640088,3089,44,"CACNA1G PRKCE ABCC8 MAPK8 PIK3R1 PIK3CD CACNA1C CACNA1A MAPK9 CACNA1D MAPK10 IRS1 PRKCZ CACNA1B KCNJ11","c2.cp"
"KEGG_ALDOSTERONE_REGULATED_SODIUM_REABSORPTION",0.462116716122651,1,0.324220948657445,0.992642073235628,2335,41,"KCNJ1 SCNN1B ATP1B4 SFN ATP1A2 ATP1B2","c2.cp"
"KEGG_PROXIMAL_TUBULE_BICARBONATE_RECLAMATION",0.7348,1,0.30366166482723,0.819017000361375,3673,23,"AQP1 SLC4A4 ATP1B4 ATP1A2 ATP1B2 GLUD1 CA2 PCK2","c2.cp"
"KEGG_ALZHEIMERS_DISEASE",0.991411282451688,1,0.187979618471214,0.715904855839806,5078,154,"MME APOE LPL NOS1 SDHD FAS CACNA1S RYR3 TNFRSF1A GRIN2C ITPR2 CASP7 CHP2 ATP2A3","c2.cp"
"KEGG_PARKINSONS_DISEASE",0.874169597499023,1,0.224014954531463,0.817254655792074,4473,112,"TH SLC6A3 SNCAIP SDHD","c2.cp"
"KEGG_AMYOTROPHIC_LATERAL_SCLEROSIS_ALS",0.600321349668608,1,-0.286540439408504,-0.919343013853428,2988,52,"GRIN2A NEFH NEFL NEFM PRPH2 GRIN1 MAPK13 MAPK11 GRIN2D ALS2 PPP3CB CYCS GRIN2B PPP3R2 GRIA2 MAPK12 GRIA1 BID","c2.cp"
"KEGG_HUNTINGTONS_DISEASE",0.905834186284544,1,-0.213530138135537,-0.825959031276723,4424,171,"BDNF CREB3L3 UCP1 CREB3L1 BBC3 SLC25A31 GRIN1 COX7A1 TBPL1 CYCS DNAH1 VDAC3 GRIN2B TBPL2 POLR2J2 AP2A1 ITPR1 CLTB AP2A2 GRM5 TAF4B PLCB4 HTT AP2S1 UQCRH IFT57 AP2M1 COX4I2 NDUFB8 PPARGC1A PPID CLTA NDUFA10 NDUFA5 SDHA POLR2K COX5A CREB5","c2.cp"
"KEGG_VIBRIO_CHOLERAE_INFECTION",0.998023324767741,1,0.167931494703399,0.537212787478808,5048,51,"MUC2 ATP6V0E1 PDIA4 ADCY3 PLCG2 SEC61A1 KCNQ1 CFTR ATP6V1E2 PRKX TJP1 PRKCA ATP6V1B1 SEC61B ACTG1 TCIRG1","c2.cp"
"KEGG_EPITHELIAL_CELL_SIGNALING_IN_HELICOBACTER_PYLORI_INFECTION",0.828195562536815,1,0.242238385032567,0.811639265817096,4217,66,"CXCR1 CXCR2 IGSF5 CXCL1 EGFR PTPRZ1 CCL5 JAM2 MAP3K14 ATP6V0E1 LYN PLCG2 ATP6V1E2 NOD1 HBEGF RELA TJP1 CHUK ATP6V1B1 NFKB1","c2.cp"
"KEGG_PATHOGENIC_ESCHERICHIA_COLI_INFECTION",0.967998409858875,1,0.209960726599569,0.680367236877715,4869,55,"TLR4 TUBB1 TUBA1C TLR5 TUBB2B TUBB6 EZR ITGB1 CD14 LY96 FYN HCLS1 TUBAL3 ROCK1 WAS KRT18 PRKCA ARPC1B RHOA ABL1 NCK1","c2.cp"
"KEGG_COLORECTAL_CANCER",0.999008133306884,1,0.159809541574648,0.528025400824095,5035,62,"RAC2 TP53 TGFBR2 BCL2 PIK3R5 TCF7L1 TGFB2 MAPK1 TGFBR1 TCF7 TGFB1 ARAF RHOA MYC TGFB3 CASP3 TCF7L2 DCC MSH3 CTNNB1 MLH1","c2.cp"
"KEGG_RENAL_CELL_CARCINOMA",0.981543294718241,1,0.198399778012156,0.664754473748708,4998,66,"PGF HIF1A ETS1 PIK3R5 VEGFC TGFB2 EGLN3 SOS2 MAPK1 TGFB1 EPAS1 TGFA RAPGEF1 GAB1 RAP1B ARAF NRAS PAK2 PAK4 TGFB3 VEGFB EGLN1 EP300 HRAS PTPN11 JUN CRK FH PIK3CG RAF1 RAP1A ARNT2 VEGFA SLC2A1 SOS1","c2.cp"
"KEGG_PANCREATIC_CANCER",0.522116903633491,1,0.285938725060929,0.964142588495061,2643,69,"ERBB2 PGF EGFR RAC2 TP53 TGFBR2 ARHGEF6 PIK3R5 STAT3 VEGFC TGFB2 MAPK1 CDK4 TGFBR1 BRCA2 TGFB1 TGFA RELA E2F2 CDKN2A CHUK ARAF NFKB1 TGFB3 VEGFB RALA","c2.cp"
"KEGG_ENDOMETRIAL_CANCER",0.943858252040613,1,0.220908817520775,0.708864678310843,4740,52,"ERBB2 EGFR TP53 PIK3R5 TCF7L1 SOS2 MAPK1 TCF7 CTNNA1 ARAF NRAS MYC TCF7L2 HRAS CTNNB1 MLH1","c2.cp"
"KEGG_GLIOMA",0.979653505237712,1,-0.201016000554631,-0.671098752369179,4862,64,"CAMK2A SHC3 PIK3R1 CAMK2G CAMK2D IGF1 PIK3CD SHC2 CALML6 AKT3 CALML3 CALM3","c2.cp"
