"pathway","pval","padj","ES","NES","nMoreExtreme","size","leadingEdge","type"
"REACTOME_LIPID_DIGESTION_MOBILIZATION_AND_TRANSPORT",0.0904055390702275,0.574602076544513,0.433942076155207,1.32856671946261,456,41,"APOA2 APOE LPL ABCA1 CETP FABP4 PLIN1 PLTP ALB CAV1 APOC2 HSPG2 APOA1 ABCG1 A2M ABHD5 APOA5","c2.cp"
"REACTOME_ION_TRANSPORT_BY_P_TYPE_ATPASES",0.0914365746298519,0.577611532417845,-0.462261875123626,-1.34669276812716,456,32,"ATP4A ATP12A FXYD2 ATP1A3 ATP1B1 ATP8A2 ATP2B3 ATP8B1 ATP2B2 ATP1A4","c2.cp"
"REACTOME_REGULATION_OF_KIT_SIGNALING",0.0921286249753403,0.578456093784561,0.566979205901892,1.39572631234354,466,16,"SOCS1 LCK SOCS6 YES1 LYN PTPN6 FYN PRKCA SH2B3","c2.cp"
"REACTOME_TRAF6_MEDIATED_IRF7_ACTIVATION",0.095982584603206,0.599023841258563,0.51866210055842,1.37153732257528,484,21,"IKBKE RNF135 TRIM25 TANK IRF1 MAVS IFNA2 IRF2 DDX58 IFIH1 EP300 IRF7","c2.cp"
"BIOCARTA_IL2RB_PATHWAY",0.0971780604133545,0.599264705882353,0.44314579469322,1.32546098370423,488,37,"IL2RA IL2RG SOCS3 FAS NMI IL2RB SOCS1 BCL2 SYK CFLAR STAT5A PTPN6 MAPK1","c2.cp"
"REACTOME_LIGAND_GATED_ION_CHANNEL_TRANSPORT",0.0969635627530364,0.599264705882353,-0.531722270851823,-1.37525911171296,478,19,"HTR3B GABRA1 GABRA3 GLRA3 GABRB2 GABRG2 GLRB GABRG3","c2.cp"
"PID_HDAC_CLASSII_PATHWAY",0.0989032901296112,0.606294725291581,-0.454052390647432,-1.3311455049069,495,33,"MEF2C GNG2 HDAC9 TUBA1B HDAC4 TUBB2A NCOR2 HDAC10 RANGAP1 HDAC5 YWHAB SUMO1 HDAC6","c2.cp"
"PID_CD8_TCR_PATHWAY",0.1014,0.617943529411765,0.399408916027987,1.28440202610647,506,53,"CD3E CD28 MAP3K14 HLA-A CD8A PTPRC LCK B2M RASGRP2 VAV1 CD86 CD80 PRF1 ORAI1 CD8B LCP2 CD3D PTPN6 FYN PRKCA CHUK NRAS STIM1 BCL10 SHC1","c2.cp"
"KEGG_SNARE_INTERACTIONS_IN_VESICULAR_TRANSPORT",0.102065613608748,0.618362430986336,-0.436820422878712,-1.31162624457523,503,38,"STX19 STX1A VAMP1 SNAP25 STX1B","c2.cp"
"REACTOME_RESPONSE_TO_ELEVATED_PLATELET_CYTOSOLIC_CA2_",0.103908858770379,0.625869637709958,0.365609713841306,1.2583366232915,528,78,"SELP ITGB3 SERPINE1 LEFTY2 THBS1 PLEK TIMP1 SPARC ALB FN1 F13A1 APOA1 SERPINA1 CLU HSPA5 A2M SRGN PROS1 SERPING1 VEGFC PECAM1 VCL CALU TGFB2 CFD MMRN1 TLN1 CAP1 VWF TGFB1 CD36 ACTN2 ABCC4 PSAP","c2.cp"
"REACTOME_ACTIVATION_OF_KAINATE_RECEPTORS_UPON_GLUTAMATE_BINDING",0.10454362685967,0.626053164315713,-0.46047682265287,-1.32562966011498,519,30,"GNG13 NCALD GNG2 GRIK1 GRIK3 GNG3","c2.cp"
"BIOCARTA_IGF1R_PATHWAY",0.107343499197432,0.639125661888157,-0.504536472487986,-1.34953000075423,534,22,"ADCY1 YWHAH PRKAR1B PIK3R1","c2.cp"
"KEGG_APOPTOSIS",0.108039215686275,0.639592156862745,0.35877378264763,1.24765919313822,550,83,"NTRK1 IL1R1 TNFRSF10C CSF2RB FAS TNFSF10 TNFRSF10D TP53 MYD88 TNFRSF1A MAP3K14 TNFRSF10A BCL2 IL1A CASP7 CHP2 PIK3R5 CFLAR CAPN2 IRAK4 IRAK3 BIRC3 PRKX RELA CHUK TNF FADD NFKB1 CASP10 CASP3 IRAK1","c2.cp"
"PID_ALPHA_SYNUCLEIN_PATHWAY",0.109284138760778,0.643286180432762,0.448725893341691,1.30927936138027,544,33,"TH SLC6A3 SNCAIP MAOB LCK HCK YES1 LYN FKBP1A SYK MAPK1 FYN FGR","c2.cp"
"BIOCARTA_P53_PATHWAY",0.110672716512133,0.646562426337707,0.55311307520066,1.36159221488697,560,16,"TIMP3 TP53 CDKN1A BCL2 GADD45A CDK4","c2.cp"
"PID_TOLL_ENDOGENOUS_PATHWAY",0.111088911088911,0.646562426337707,0.484786980626766,1.33103826138013,555,25,"S100A9 S100A8 TLR4 MYD88 TLR3 BGN SAA1 TLR1 HSPD1 CD14 TLR2 LY96 IRAK4","c2.cp"
"REACTOME_RIG_I_MDA5_MEDIATED_INDUCTION_OF_IFN_ALPHA_BETA_PATHWAYS",0.113072803015275,0.654432535887289,0.382302855196917,1.26316374080364,569,62,"S100A12 IKBKE RNF135 SAA1 TRIM25 TNFAIP3 TANK NLRC5 IRF1 MAP3K1 HERC5 S100B MAVS RELA NFKB2 UBE2L6 IFNA2 IRF2 DDX58 CHUK FADD IFIH1 CASP10 EP300 NLRX1 IRF7 AGER NFKBIB RPS27A CASP8 UBA52","c2.cp"
"SIG_BCR_SIGNALING_PATHWAY",0.115225526885956,0.663186921410282,0.407476457082655,1.27720007229469,584,46,"NFATC2 NR0B2 BCR PTPRC BCL2 ITPR2 NFATC1 VAV1 LYN SYK PLCG2 CR2 CD81 DAG1 SOS2 MAPK1 BTK","c2.cp"
"BIOCARTA_TEL_PATHWAY",0.116729211929686,0.664868714110392,0.531602609718575,1.3511520122479,590,18,"TERT EGFR TP53 BCL2 HSP90AA1 TEP1 PRKCA MYC","c2.cp"
"REACTOME_TCR_SIGNALING",0.116801260586961,0.664868714110392,0.396536879812783,1.26388906897672,592,50,"CD3E ITK HLA-DRB1 PTPRC HLA-DRB5 LCK FYB HLA-DPA1 HLA-DPB1 HLA-DQA1 CD4 VASP LCP2 TAB2 CD3D WAS RELA CHUK PAK2 NCK1","c2.cp"
"KEGG_OXIDATIVE_PHOSPHORYLATION",0.121646528773295,0.68866559458543,-0.328909592284803,-1.20350581112714,593,113,"ATP4A ATP12A ATP6V1G2 ATP6V1C2 COX7A1 ATP6V1C1 ATP6V1A ATP6V1B2 ATP6AP1 ATP6V0A1 UQCRH ATP6V0B COX4I2 ATP6V0A4 ATP6V0C NDUFB8 ATP6V1D ATP6V0D1 NDUFA10 NDUFA5 SDHA COX5A ATP6V1E1 COX17 ATP6V1H NDUFS5 ATP6V1G1 UQCRC1 COX6C COX11 NDUFAB1 ATP6V1F ATP5J2 ATP5D NDUFC2 NDUFA11 ATP5J NDUFA4 NDUFA9 NDUFV1 NDUFS7 COX6A1 NDUFB9 ATP5H ATP6V0E2","c2.cp"
"KEGG_PATHWAYS_IN_CANCER",0.123402555910543,0.690094499708048,0.276474537948288,1.13914764880038,617,314,"WNT3A NTRK1 LAMC2 MMP9 WNT6 FZD7 GLI2 FOXO1 ERBB2 GLI3 NKX3-1 FGFR3 CSF3R RXRG FGF2 PGF MMP2 EGFR FZD2 FAS ITGAV LAMA1 RAC2 FGF11 TP53 BCR FN1 TGFBR2 RARB CDKN2B FGF1 SMO CDKN1A LAMC1 COL4A6 BCL2 WNT1 WNT8A WNT11 HIF1A BMP2 ITGA6 COL4A1 LAMA4 RUNX1 ETS1 PIK3R5 LAMB2 FZD5 TCF7L1 PTCH1 SPI1 MECOM STAT3 HSP90AA1 ITGB1 VEGFC CEBPA STAT5A PLCG2 TGFB2 GLI1 TRAF5 SUFU EGLN3 HDAC1 SOS2 MAPK1 CDK4 TGFBR1 BRCA2 BIRC3 TCF7 TGFB1 EPAS1 CSF2RA FZD10 HSP90B1 TGFA RELA MITF CCDC6 NFKB2 PAX8 E2F2 CBLB CTNNA1 RXRA CDKN2A ITGA2 FZD6 PRKCA CHUK FADD ARAF NFKB1 NRAS FZD4 WNT5B RHOA WNT2B ABL1 FGFR2 MYC TGFB3 CSF1R CASP3 JUP COL4A2 PPARG TCF7L2 GSTP1 TPR VEGFB EGLN1 STAT5B RALA","c2.cp"
"BIOCARTA_KERATINOCYTE_PATHWAY",0.123897275044109,0.690094499708048,0.406297729252308,1.26938891943305,631,45,"HOXA7 PRKCH EGFR FAS MAP3K5 TNFRSF1A MAP3K14 BCL2 ETS1 TNFRSF1B CEBPA MAP3K1 MAPK1 RELA SP1 PRKCA CHUK TNF NFKB1","c2.cp"
"REACTOME_BIOLOGICAL_OXIDATIONS",0.123091976516634,0.690094499708048,0.32682080939909,1.20152770216352,628,118,"MAT1A NAT2 FMO2 CYP19A1 CYP24A1 MGST1 GSTM1 CYP11A1 CYP7B1 SULT1C4 CYP2J2 CYP21A2 ADH1B CYP1B1 CYP7A1 CYP4F11 FMO1 ALDH1A1 PTGIS UGT1A7 ADH1C GSTM5 MAOB CYP2C19 NAT1 CYP8B1 SMOX ALDH2 MAOA CYP27B1 SULT1C2 ACSS1 GCLC CYP46A1 SULT1B1 CYP27A1 BPNT1 GCLM SLC35D1 PTGS1 TBXAS1 PAPSS2","c2.cp"
"BIOCARTA_CK1_PATHWAY",0.127046754783981,0.703852609391467,0.542677485398538,1.33590304124527,643,16,"DRD2 PPP1R1B DRD1","c2.cp"
"KEGG_GALACTOSE_METABOLISM",0.13026973026973,0.705137310606061,0.474633593768089,1.30316097314516,651,25,"MGAM HK3 G6PC G6PC2 PGM1 PGM2 HK2 B4GALT1","c2.cp"
"KEGG_ONE_CARBON_POOL_BY_FOLATE",0.130681818181818,0.705137310606061,0.529945176146545,1.3288309794093,666,17,"ALDH1L1 MTHFD2 AMT MTHFD1 ATIC MTHFS SHMT1 GART MTHFD2L FTCD TYMS","c2.cp"
"ST_INTERLEUKIN_4_PATHWAY",0.129,0.705137310606061,0.485904817015741,1.31055168231327,644,23,"CISH IL2RG NR0B2 IL13RA1 IL4R SOS2","c2.cp"
"PID_HIF1A_PATHWAY",0.129019530479384,0.705137310606061,0.541561203078137,1.3331551016553,653,16,"TP53 HIF1A HSP90AA1 EGLN3 HIF3A CDKN2A EGLN1","c2.cp"
"PID_INTEGRIN5_PATHWAY",0.130485893416928,0.705137310606061,0.53031591788259,1.3297606097303,665,17,"ITGB7 ITGAV ITGB5 VCAM1 FN1 ITGB8 PLAUR ITGB6 TGFBR1 PLAU","c2.cp"
"REACTOME_SYNTHESIS_OF_PIPS_AT_THE_PLASMA_MEMBRANE",0.131684760755931,0.7068674204308,-0.446408642614832,-1.28512990897697,654,30,"PIK3C2G PIP5K1B PIP5K1C PIK3R1 INPP5J SYNJ2 PIK3CD SYNJ1","c2.cp"
"REACTOME_TAK1_ACTIVATES_NFKB_BY_PHOSPHORYLATION_AND_ACTIVATION_OF_IKKS_COMPLEX",0.1332,0.711315463917526,0.483711605126394,1.30463629018173,665,23,"S100A12 SAA1 TAB2 S100B NOD1 RELA NFKB2 CHUK IRAK1 AGER NFKBIB","c2.cp"
"REACTOME_BILE_ACID_AND_BILE_SALT_METABOLISM",0.134887427774457,0.716632693201731,0.477526832114799,1.30160806028708,676,24,"AKR1D1 CYP7B1 CYP7A1 FABP6 ACOX2 ALB CH25H CYP8B1 HSD3B7 CYP46A1 SLC10A2 CYP27A1","c2.cp"
"KEGG_PHENYLALANINE_METABOLISM",0.140478056426332,0.719156108757807,0.523994373882236,1.31390941627959,716,17,"DDC HPD MAOB IL4I1 ALDH3B1 MAOA PRDX6","c2.cp"
"KEGG_NATURAL_KILLER_CELL_MEDIATED_CYTOTOXICITY",0.139898397811645,0.719156108757807,0.325304657785482,1.18678124271696,715,112,"FCGR3B CD48 HLA-G NFATC2 TNFRSF10C FAS ICAM1 TNFSF10 TNFRSF10D RAC2 FCER1G FCGR3A SH3BP2 HLA-A TNFRSF10A CHP2 NFATC4 NFATC1 LCK ITGB2 PIK3R5 VAV1 TYROBP HLA-B SYK MICA PRF1 SH2D1A PLCG2 HLA-C LCP2 NCR3 PTPN6 ICAM2 SOS2 MAPK1 FYN HLA-E NCR1 IFNAR2 IFNA2 ITGAL IFNGR1 PRKCA NFATC3 TNF ARAF NRAS","c2.cp"
"BIOCARTA_AMI_PATHWAY",0.142603199683982,0.719156108757807,0.515671832112392,1.3106614243054,721,18,"COL4A6 AHSP COL4A1 PROS1 SERPINC1 PLAT COL4A3 F2R F10 COL4A2 PROC","c2.cp"
"BIOCARTA_ALK_PATHWAY",0.142228445689138,0.719156108757807,0.427155014691292,1.26243863340389,710,35,"NPPB NKX2-5 GATA4 NOG TGFBR3 TGFBR2 SMAD6 SMAD1 WNT1 BMP7 BMP2 ACVR1 TGFB2 TGFBR1 TGFB1 BMPR1A BMP5","c2.cp"
"REACTOME_ACTIVATED_AMPK_STIMULATES_FATTY_ACID_OXIDATION_IN_MUSCLE",0.142998222397788,0.719156108757807,0.515428501919358,1.31004296217985,723,18,"PRKAG3 CPT2 SLC25A20 CPT1A ACACB ACSL1 PRKAG2","c2.cp"
"REACTOME_SMAD2_SMAD3_SMAD4_HETEROTRIMER_REGULATES_TRANSCRIPTION",0.136663336663337,0.719156108757807,0.471094992092512,1.29344533635994,683,25,"SERPINE1 WWTR1 CDKN2B TGIF2 HDAC1 TFDP1 TGIF1 SP1 MYC RPS27A UBA52","c2.cp"
"REACTOME_TRANSMEMBRANE_TRANSPORT_OF_SMALL_MOLECULES",0.142479136983513,0.719156108757807,-0.265520856366631,-1.11341535016431,699,390,"SLC30A3 SLC6A7 SLC17A7 ATP4A GNG13 SLC17A6 SLC6A19 HTR3B SLC44A5 SLC26A4 ATP12A SLCO4C1 ADCY1 SLCO2A1 GABRA1 SLC22A18 GNG2 SLC26A3 SLC39A2 ABCG8 SLC8A2 GABRA3 MYO5B GLRA3 AQP3 GABRB2 AVPR2 PRKAR1B FXYD2 ATP1A3 SLC39A4 ATP1B1 ATP6V1G2 ABCG4 GNAS SLC7A3 SLC5A11 SLC4A8 ABCC3 SLC39A10 SLC22A12 GNG3 GABRG2 ATP6V1C2 SLC2A6 GLRB ABCC8 TFRC SLC9A3 SLC22A16 SLC5A2 ABCA10 ATP8A2 ATP2B3 SLC29A2 SLC8A3 ATP8B1 SLC4A9 ABCA7 SLC24A2 SLC43A1 SLC5A5 ABCG5 SLC5A1 GABRG3 ATP6V1C1 SLC12A5 ATP6V1A SLC16A7 SLC7A6 ATP6V1B2 SLC24A4 SLC24A5","c2.cp"
"REACTOME_AMINE_LIGAND_BINDING_RECEPTORS",0.1378896882494,0.719156108757807,0.436845005909609,1.26736941411804,689,32,"DRD3 DRD2 HTR2C HTR1D HTR1B DRD1 HTR4 HTR2B HRH3 HRH4 HTR6","c2.cp"
"REACTOME_METABOLISM_OF_RNA",0.138081107814046,0.719156108757807,0.28114792941233,1.14016778279618,697,266,"TNFSF13 ZFP36L1 RPL10P9 HSPA1B RPS27 HSPB1 RPS4Y1 PABPC1 PSMB8 MAPKAPK2 RPL21P16 RPL21 RPL23AP2 NUP37 RPS19 RPLP1 RPS15P5 RPS3 RPS2 RPL23AP42 RPSA HSPA8 ZFP36 PSMB9 RPL23A RPS16 RPL18A RPL37 RPL13A RPS5 RPL28 RPS13 PRKCA RPS18 RPL30 RPS12 RPL4 GEMIN5 RPL27A RPL39 RPS28P7 RPL10P16 RPL10 PSMB10 TNKS1BP1 RPL3L ETF1 EIF4A1 RPS15A RPS9 RPLP2 RPS6 RPL5 RPS20 RPS11 PRMT5 RPS28 NCBP2 RPL11 FAU TPR RPLP0 RPL19 RPS17 NUP35 NCBP1 SNRPG RPS4X RPL29 RPL12 RPS25 RPS3A WDR77 PATL1 CNOT6 RPL3 RPL32 RPS27A RPL41 RPL35A UBA52 RPS14 RPS8 RPL7 EIF4B PSME1 RPL17 RPL10A RPS29 RPS23 RPS10 NUP188 RPS19P3 RBM8A RPL37A RPL35 RPL18 XPO1 RPL13 RPL27 EIF4G1 PSMB1 TNPO1 RPL24 RPL31 SMG1 PSMD9 PSMA2 NUP153 RPL6 RPL22 RPL23 SNRPD3 RPL26 NUP205 RPL7A NUP210 SNRPF PSME4 SMG8 NUP43 RPL14 PSMA5 ANP32A EXOSC7 RPL36A PRKCD SNRPD2 DCP1A DCP1B RPL34 RPS15 CASC3 EDC3","c2.cp"
"REACTOME_GABA_RECEPTOR_ACTIVATION",0.139086294416244,0.719156108757807,-0.390118418447836,-1.24000061797703,684,50,"KCNJ6 KCNJ3 GABBR2 ADCY1 GABRA1 GNG2 GABRA3 GABRB2 KCNJ9 GNG3 GABRG2 KCNJ12 GABRG3 ADCY6 KCNJ4","c2.cp"
"REACTOME_TRANSFERRIN_ENDOCYTOSIS_AND_RECYCLING",0.142685129440096,0.719156108757807,-0.470469717299872,-1.28585620268025,710,24,"ATP6V1G2 ATP6V1C2 TFRC ATP6V1C1 ATP6V1A ATP6V1B2 ATP6V0B TF ATP6V0A4 MCOLN1 ATP6V0C ATP6V1D ATP6V0D1 ATP6V1E1 ATP6V1H ATP6V1G1 ATP6V1F","c2.cp"
"REACTOME_PHASE1_FUNCTIONALIZATION_OF_COMPOUNDS",0.144501786423184,0.723207008378833,0.366844860602995,1.22070456634086,727,64,"FMO2 CYP19A1 CYP24A1 CYP11A1 CYP7B1 CYP2J2 CYP21A2 ADH1B CYP1B1 CYP7A1 CYP4F11 FMO1 ALDH1A1 PTGIS ADH1C MAOB CYP2C19 CYP8B1 SMOX ALDH2 MAOA CYP27B1 ACSS1 CYP46A1","c2.cp"
"KEGG_BETA_ALANINE_METABOLISM",0.147469111199681,0.730995211496984,0.481974420821542,1.28706256004736,739,22,"GAD2 ALDH7A1 EHHADH ALDH2 ALDH9A1 HADHA UPB1 ALDH3A2 HIBCH AOC3 ABAT","c2.cp"
"PID_TELOMERASE_PATHWAY",0.146884858044164,0.730995211496984,0.36421779684714,1.21672252498076,744,65,"WT1 TERT EGFR IRF1 HSP90AA1 HDAC1 MAPK1 TGFB1 WRN IFNAR2 SP1 HUS1 NFKB1 ABL1 MYC NBN ZNFX1 SP3","c2.cp"
"PID_GLYPICAN_1PATHWAY",0.14912629070691,0.735689700820757,0.452236384139305,1.27054508822662,750,27,"FGF2 LAMA1 PLA2G2A TGFBR2 TDGF1 LCK HCK YES1 LYN TGFB2 FYN FGR SERPINC1 TGFBR1 TGFB1","c2.cp"
"REACTOME_GABA_SYNTHESIS_RELEASE_REUPTAKE_AND_DEGRADATION",0.151082074316047,0.74180582460391,-0.515894102096996,-1.29146051788886,739,17,"STX1A SYT1 SNAP25 RIMS1 STXBP1 RAB3A","c2.cp"
"PID_AR_PATHWAY",0.152325813535636,0.744384635957164,0.368903290328502,1.21036969092691,762,60,"NKX3-1 TMPRSS2 PAWR LATS2 CTDSP2 CTDSP1 CMTM2 SVIL KDM3A BRCA1 MAK GSN TGIF1 CDKN2A NCOA2 TGFB1I1 PATZ1 SNURF NRIP1 VAV3 PRDX1 MED1 RPS6KA3 CTNNB1 CASP8 CDK6","c2.cp"
"PID_REELIN_PATHWAY",0.155238286748442,0.744568819774933,-0.439660127616419,-1.25730545281292,771,29,"GRIN2A DAB1 CDK5R1 MAP1B MAPK8 PIK3R1 GRIN2B MAPT GSK3B NCK2 ITGA3 LRP8 CDK5 PAFAH1B1 MAPK8IP1 ARHGEF2","c2.cp"
"PID_P53_DOWNSTREAM_PATHWAY",0.155135451179107,0.744568819774933,0.311032306142626,1.16311205361721,795,134,"POU4F1 POU4F2 BCL2A1 SERPINE1 EDN2 TP63 TNFRSF10C MMP2 TP53BP2 LIF EGFR SFN FOXA1 FAS BCL2L14 TNFRSF10D TP53 CAV1 SPP1 TNFRSF10A CDKN1A BCL2 CD82 EPHA2 DDIT4 PYCARD CASP1 GADD45A SH2D1A S100A2 MCL1 IRF5 HIC1 PERP ATF3 TFDP1 TGFA SERPINB5 BCL6 TAP1 ZNF385A E2F2 SP1 VDR AIFM2","c2.cp"
"PID_SYNDECAN_3_PATHWAY",0.154862892089169,0.744568819774933,0.524938700987997,1.29223567585857,784,16,"EGFR SDC3 FYN APH1A PSENEN PTN APH1B POMC NCSTN AGRP PSEN1","c2.cp"
"REACTOME_REGULATION_OF_WATER_BALANCE_BY_RENAL_AQUAPORINS",0.154622527250706,0.744568819774933,-0.407802596487718,-1.23894989936936,765,40,"GNG13 ADCY1 GNG2 MYO5B AQP3 AVPR2 PRKAR1B GNAS GNG3","c2.cp"
"BIOCARTA_CCR3_PATHWAY",0.158033184945366,0.754481011997232,-0.488913802663161,-1.28015028900896,780,20,"PIK3C2G LIMK1 GNAS","c2.cp"
"PID_IL2_STAT5_PATHWAY",0.158856235107228,0.754931465922423,0.446923621291808,1.25561903411523,799,27,"IL2RA IL2RG IL2RB BCL2 LCK ELF1 PRF1 STAT5A LTA SP1 MYC SHC1 STAT5B PTPN11 CDK6 JAK1","c2.cp"
"REACTOME_ER_PHAGOSOME_PATHWAY",0.160484030946241,0.759184730868975,0.366841542643707,1.20259341290534,808,59,"HLA-G HLA-A HLA-F B2M HLA-B HLA-K PSMB8 HLA-C SEC61A1 PSMB9 TAP1 PDIA3 PSMB10 CALR SEC61B RPS27A UBA52 PSME1 SEC61G PSMB1 PSMD9 PSMA2","c2.cp"
"KEGG_STEROID_BIOSYNTHESIS",0.163592134603689,0.77037023386101,-0.519082835925101,-1.2845071121812,806,16,"SOAT2 MSMO1 DHCR24 SQLE CYP51A1 EBP TM7SF2 DHCR7 HSD17B7 FDFT1 NSDHL","c2.cp"
"KEGG_RENIN_ANGIOTENSIN_SYSTEM",0.164802825191289,0.770573231306216,0.528428371990934,1.28171001028148,839,15,"CTSG MME AGTR1 ACE2 AGT ACE ANPEP","c2.cp"
"BIOCARTA_HDAC_PATHWAY",0.165122835279903,0.770573231306216,-0.445534748592238,-1.25147144676875,819,27,"MYOD1 MEF2C YWHAH PIK3R1 IGF1 PPP3CB CALM3 HDAC5","c2.cp"
"PID_ERB_GENOMIC_PATHWAY",0.166764763586423,0.771287031587208,0.527213248803368,1.27876271290726,849,15,"NR0B2 C3 NR0B1 DDX54 NCOA2 ESR2","c2.cp"
"PID_RXR_VDR_PATHWAY",0.166633406505687,0.771287031587208,0.4506787143133,1.25185918331541,834,26,"ABCA1 RXRG PPARA RARB RARG BCL2 THRA TGFB1 SREBF1 VDR RXRA TNF NR1H3 PPARG","c2.cp"
"KEGG_GLYOXYLATE_AND_DICARBOXYLATE_METABOLISM",0.168660044597608,0.776585805347208,-0.516494038547269,-1.27810095036332,831,16,"HAO2 HAO1 PGP AFMID","c2.cp"
"PID_VEGFR1_2_PATHWAY",0.170813586097946,0.783021571670232,0.351691852239086,1.18585229299796,864,69,"ITGB3 ITGAV KDR CAV1 MYOF CDH5 HSP90AA1 MAPKAPK2 VCL SH2D2A SHB PTPN6 MAPK1 FYN NOS3 ROCK1 NEDD4 IQGAP1 GAB1 CTNNA1 PRKCA AKAP1 PAK2 RHOA PXN NCK1 FLT1 MAP2K3 PRKAA1 GRB10 PTPN11 CTNNB1 FES FBXW11 CBL","c2.cp"
"REACTOME_AMINE_DERIVED_HORMONES",0.173631547969394,0.792432967825075,0.523212270643142,1.26905828742466,884,15,"TH DDC PNMT DIO3","c2.cp"
"BIOCARTA_BIOPEPTIDES_PATHWAY",0.176066302809784,0.796527029305397,-0.395666520714206,-1.20900433092358,870,41,"KNG1 CAMK2A STAT4 MAPK8 CAMK2G CAMK2D PTK2B GNAI1 MAPT CALM3","c2.cp"
"REACTOME_DOWNSTREAM_TCR_SIGNALING",0.175656707439342,0.796527029305397,0.418889268957561,1.22222292648528,875,33,"CD3E HLA-DRB1 HLA-DRB5 LCK HLA-DPA1 HLA-DPB1 HLA-DQA1 CD4 TAB2 CD3D RELA CHUK","c2.cp"
"KEGG_CARDIAC_MUSCLE_CONTRACTION",0.179346723473321,0.800875885855003,-0.347121965189506,-1.17790780495585,883,71,"TNNT2 CACNB3 CACNG6 FXYD2 ATP1A3 ATP1B1 CACNG8 CACNG2 CACNA1F CACNG7 COX7A1 CACNB1 CACNA1C CACNG3 CACNA2D1 CACNA1D ATP1A4 SLC9A1 CACNB2 SLC9A6 UQCRH ATP1A1 COX4I2","c2.cp"
"KEGG_ADIPOCYTOKINE_SIGNALING_PATHWAY",0.178136059771923,0.800875885855003,0.351158264157638,1.17984966540722,905,67,"PRKAG3 SOCS3 NPY RXRG SLC2A4 PPARA G6PC TNFRSF1A G6PC2 CPT1A TNFRSF1B PCK2 STAT3 ACACB ACSL1 CD36 PRKAG2 RELA RXRA ACSL5 CHUK TNF PCK1 NFKB1 LEPR IRS4 PRKAA1 POMC PTPN11 NFKBIB ADIPOR1","c2.cp"
"REACTOME_PURINE_METABOLISM",0.178664527772208,0.800875885855003,0.417918429823387,1.21939024029433,890,33,"NT5C1B NT5E GMPR PNP AMPD1 ADK CAT ATIC NT5C2 ADSSL1 AMPD2 XDH","c2.cp"
"BIOCARTA_PML_PATHWAY",0.182284474255277,0.802536446604243,0.511492538002956,1.25913540818926,923,16,"PAX3 FAS TP53 TNFRSF1A TNFRSF1B SP100 TNF SIRT1 HRAS PML","c2.cp"
"BIOCARTA_TH1TH2_PATHWAY",0.182284474255277,0.802536446604243,0.511578451740554,1.2593469010675,923,16,"IL2RA CD28 HLA-DRB1 CD40LG IL18R1 IL18 HLA-DRA CD40 CD86 IL4R IL12B","c2.cp"
"PID_NFAT_TFPATHWAY",0.181458003169572,0.802536446604243,0.395801013887797,1.20529011478144,915,40,"GATA3 IL2RA NFATC2 GBP3 CD40LG FOSL1 IKZF1 NFATC1 TBX21 TLE4 SLC3A2 CDK4 CBLB NFATC3 TNF CASP3 PPARG","c2.cp"
"REACTOME_A_TETRASACCHARIDE_LINKER_SEQUENCE_IS_REQUIRED_FOR_GAG_SYNTHESIS",0.182817182817183,0.802536446604243,0.450475414258068,1.23683192030724,914,25,"GPC5 SDC2 GPC3 SDC4 HSPG2 BGN DCN GPC6 SDC3 CSPG4 BCAN GPC4 GXYLT2 VCAN","c2.cp"
"REACTOME_RIP_MEDIATED_NFKB_ACTIVATION_VIA_DAI",0.184475607347422,0.803011467277015,0.494545294118786,1.25696499054071,933,18,"S100A12 TLR3 SAA1 S100B RELA NFKB2 CHUK RIPK3 AGER NFKBIB RIPK1 ZBP1 TICAM1","c2.cp"
"REACTOME_TOLL_RECEPTOR_CASCADES",0.183833627624093,0.803011467277015,0.314958449286788,1.15195293782701,936,114,"UNC93B2 S100A12 TLR4 CD180 TLR8 CTSS TLR5 MYD88 IKBKE TLR3 SAA1 TLR1 PELI1 UNC93B1 MAPKAPK3 MAPKAPK2 CD14 MAP3K1 PLCG2 TLR2 MAPK7 LY86 TAB2 LY96 IRAK4 IRAK3 MAPK1 S100B RPS6KA5 BTK NOD1 SIGIRR HSP90B1 RELA NFKB2 PPP2R1B CHUK TLR7","c2.cp"
"KEGG_PENTOSE_PHOSPHATE_PATHWAY",0.19047619047619,0.808108413325805,0.451395295166686,1.23038060911178,955,24,"TKTL1 FBP1 TKTL2 PGM1 PGM2 H6PD DERA ALDOC TKT PGD","c2.cp"
"KEGG_LYSINE_DEGRADATION",0.189333862014274,0.808108413325805,0.396778809799418,1.2004759825133,954,39,"PIPOX BBOX1 ALDH7A1 EHHADH PLOD2 ALDH2 ALDH9A1 HADHA AASS HADH GCDH ALDH3A2 PLOD1 ACAT1 EHMT2 SETD7 TMLHE SUV39H2 DLST SETMAR AASDH EHMT1 OGDH ECHS1","c2.cp"
"KEGG_PROPANOATE_METABOLISM",0.186650679456435,0.808108413325805,0.418564818042439,1.21433515557378,933,32,"LDHC ALDH7A1 SUCLG2 EHHADH ALDH6A1 ACSS3 ALDH2 ALDH9A1 ACSS1 HADHA LDHAL6B ACACB ALDH3A2 HIBCH ABAT MUT ACAT1 LDHB","c2.cp"
"BIOCARTA_NTHI_PATHWAY",0.1906,0.808108413325805,0.456148671641517,1.23029529255601,952,23,"MYD88 TGFBR2 MAP3K14 TLR2 TGFBR1 RELA CHUK TNF NFKB1 MAP2K3 IL1B EP300","c2.cp"
"BIOCARTA_ACTINY_PATHWAY",0.191106719367589,0.808108413325805,0.474702644058163,1.23810224271086,966,20,"NTRK1 PIR WASF2 WASF3 ARPC1B NCK1 ARPC2 ABI2 ARPC3 ACTR3","c2.cp"
"PID_TAP63_PATHWAY",0.187735661837666,0.808108413325805,0.365062506387027,1.17963946805703,945,54,"NQO1 TP63 ITGB4 CABLES1 FAS DHRS3 CDKN1A GADD45A S100A2 JAG1 PERP DST SERPINB5 SP1 VDR CDKN2A WWP1 CHUK ABL1 DICER1 EP300 HBP1 SHH AEN TFAP2C PML","c2.cp"
"REACTOME_RNA_POL_I_PROMOTER_OPENING",0.189523248969982,0.808108413325805,0.375997727578037,1.18951842630426,965,48,"HIST2H3D HIST2H4A H3F3AP6 HIST2H3C HIST2H3A HIST1H2AD HIST2H4B HIST1H2BK HIST1H2AB HIST4H4 HIST2H2AA4 HIST1H3D HIST1H2BC HIST1H2BE HIST1H2AC HIST2H2AC HIST1H2BJ HIST1H4I HIST1H3G HIST1H2BF HIST1H4C MBD2 HIST1H2BD","c2.cp"
"KEGG_CYSTEINE_AND_METHIONINE_METABOLISM",0.192901544014438,0.809535403867388,0.410245619389135,1.2045374141235,961,34,"MAT1A DNMT3L SDS AHCYL1 LDHC IL4I1 AHCYL2 LDHAL6B ADI1 CBS TRDMT1","c2.cp"
"REACTOME_SEMA4D_INDUCED_CELL_MIGRATION_AND_GROWTH_CONE_COLLAPSE",0.193006993006993,0.809535403867388,0.446035666099372,1.22464208248925,965,25,"MYH11 ERBB2 MYL9 LIMK2 RAC2 RHOC PLXNB1 RHOB ROCK1 RHOG RHOA","c2.cp"
"BIOCARTA_TOLL_PATHWAY",0.194753577106518,0.813567362428843,0.400493425811678,1.19788660188215,979,37,"TLR4 PGLYRP1 PPARA MYD88 MAP3K14 TLR3 CD14 MAP3K1 TLR2 TAB2 LY96 RELA CHUK TLR7 NFKB1 IRAK1 MAP2K3","c2.cp"
"REACTOME_INSULIN_RECEPTOR_RECYCLING",0.19761567993534,0.814999667265589,-0.461355313908449,-1.21855003464321,977,21,"ATP6V1G2 ATP6V1C2 ATP6V1C1 ATP6V1A ATP6V1B2 ATP6V0B ATP6V0A4 ATP6V0C ATP6V1D ATP6V0D1 ATP6V1E1 INSR ATP6V1H ATP6V1G1 ATP6V1F","c2.cp"
"REACTOME_PPARA_ACTIVATES_GENE_EXPRESSION",0.19814421032283,0.814999667265589,0.318840200836554,1.14608472989108,1024,101,"APOA2 ABCA1 TBL1X CTGF CYP7A1 YAP1 AGT PPARA WWTR1 CPT2 PLIN2 TXNRD1 TEAD3 TEAD1 APOA1 TEAD4 ME1 CPT1A ANGPTL4 G0S2 ACOX1 APOA5 ABCB4 ACSL1 CD36 PEX11A SREBF1 RXRA NCOA2","c2.cp"
"REACTOME_HS_GAG_DEGRADATION",0.19703557312253,0.814999667265589,0.471476978632683,1.22968917898031,996,20,"GPC5 SDC2 HPSE2 GPC3 SDC4 HSPG2 GPC6 SDC3 NAGLU GPC4 GLB1 SGSH","c2.cp"
"REACTOME_SIGNALING_BY_TGF_BETA_RECEPTOR_COMPLEX",0.198243162307846,0.814999667265589,0.355831719750165,1.16748193889103,992,60,"SERPINE1 PARD3 WWTR1 TGFBR2 CDKN2B PMEPA1 TGIF2 FKBP1A HDAC1 PPP1R15A TGFBR1 TGFB1 TFDP1 TGIF1 SP1 SMURF2 RHOA MYC PARP1 PPP1CC F11R PPP1CA RPS27A UBA52","c2.cp"
"KEGG_NOD_LIKE_RECEPTOR_SIGNALING_PATHWAY",0.206760229294327,0.817274822503055,0.355586386661986,1.15942403189783,1045,57,"CASP5 CXCL1 CCL5 CCL2 CARD6 CCL13 TRIP6 IL18 TNFAIP3 PYCARD CASP1 HSP90AA1 TAB2 CARD8 MAPK1 NOD1 BIRC3 HSP90B1 RELA CHUK TNF NFKB1","c2.cp"
"BIOCARTA_NO1_PATHWAY",0.215362959983913,0.817274822503055,-0.413862101259149,-1.18353028610254,1070,29,"KNG1 TNNI1 PRKAR1B PRKG2 PDE2A CHRM1 BDKRB2 SLC7A1 CALM3 CHRNA1","c2.cp"
"BIOCARTA_ECM_PATHWAY",0.2134,0.817274822503055,0.448296354213185,1.20911651956305,1066,23,"MYLK ITGB1 ITGA1 TLN1 MAPK1 FYN GSN ARHGAP5 ROCK1 RHOA PXN SHC1 HRAS PFN1","c2.cp"
"BIOCARTA_HIVNEF_PATHWAY",0.215062265269816,0.817274822503055,0.352787175269011,1.15029693063323,1087,57,"FAS MAP3K5 TNFRSF1A MAP3K14 BCL2 CASP7 TNFRSF1B CFLAR MAP3K1 ARHGDIB BIRC3 GSN RELA CRADD CHUK TNF FADD NFKB1 PAK2 CASP3 LMNB1 ACTG1 PARP1","c2.cp"
"BIOCARTA_IL7_PATHWAY",0.210423197492163,0.817274822503055,0.487693848822928,1.22288629834429,1073,17,"IL2RG IL7R IL7 NMI BCL2 LCK STAT5A FYN","c2.cp"
"BIOCARTA_BAD_PATHWAY",0.210114388922336,0.817274822503055,-0.44006297376603,-1.202750535432,1046,24,"ADCY1 YWHAH PRKAR1B PIK3R1 IGF1","c2.cp"
"BIOCARTA_UCALPAIN_PATHWAY",0.201066561327276,0.817274822503055,0.486155910929553,1.23564204785679,1017,18,"ITGB3 CAPNS2 EZR ITGB1 ITGA1 TLN1 ACTN2 RHOA PXN","c2.cp"
"PID_TXA2PATHWAY",0.210494931425164,0.817274822503055,0.356949964867748,1.15667851428156,1058,55,"PRKCH PTGDR EGFR ICAM1 PIK3R6 VCAM1 GNA12 SLC9A3R1 LCK HCK YES1 SELE PIK3R5 LYN SYK PRKG1 GNA14 GNA13 FYN FGR NOS3 TGM2 ROCK1","c2.cp"
"PID_NEPHRIN_NEPH1_PATHWAY",0.213108162444713,0.817274822503055,-0.411074210373352,-1.18340845612995,1059,30,"MAPK8 MAP2K4 PIK3R1 NPHS1 PIK3CD MAPK9 TRPC6 MAPK10 PRKCZ ARRB2 NCK2 PRKCI PARD6A WASL","c2.cp"
"REACTOME_SYNTHESIS_OF_BILE_ACIDS_AND_BILE_SALTS",0.207386924748173,0.817274822503055,0.483278251365548,1.22832802147809,1049,18,"AKR1D1 CYP7B1 CYP7A1 ACOX2 CH25H CYP8B1 HSD3B7 CYP46A1 CYP27A1","c2.cp"
"REACTOME_REGULATION_OF_HYPOXIA_INDUCIBLE_FACTOR_HIF_BY_OXYGEN",0.214723926380368,0.817274822503055,0.458236224808927,1.21174862054654,1084,21,"CA9 HIF1A EGLN3 EPAS1 HIF3A EGLN1 EP300 RPS27A UBA52 VEGFA UBE2D1 CREBBP EPO UBE2D3","c2.cp"
"REACTOME_CHONDROITIN_SULFATE_BIOSYNTHESIS",0.205847491110233,0.817274822503055,0.476577721088066,1.23079310173946,1041,19,"CHST7 CHST11 BGN DCN CHSY1 CHST3 CHST15 CSPG4 BCAN CSGALNACT2 VCAN","c2.cp"
"REACTOME_RECRUITMENT_OF_MITOTIC_CENTROSOME_PROTEINS_AND_COMPLEXES",0.210165389269867,0.817274822503055,-0.34813767273869,-1.15768084550289,1041,63,"NEK2 TUBA4A CDK1 YWHAG TUBB4B PRKACA TUBG1 CSNK1E CLASP1 FGFR1OP TUBB4A CENPJ TUBG2 CEP290 TUBB TUBGCP6 DYNLL1 DYNC1H1 CCNB1 CEP63 DCTN1 PAFAH1B1 TUBGCP2 DCTN2 ACTR1A SSNA1","c2.cp"
"REACTOME_STRIATED_MUSCLE_CONTRACTION",0.21032619571743,0.817274822503055,-0.436776581177467,-1.20499554063895,1050,25,"TNNT2 MYBPC2 TNNI1","c2.cp"
"REACTOME_MUSCLE_CONTRACTION",0.207242668765991,0.817274822503055,0.377952884719616,1.17452063565702,1052,44,"MYH11 ACTG2 ACTA2 VIM LMOD1 MYL9 MYH6 ITGB5 DES SORBS1 MYLK TCAP TNNC1 MYBPC1 VCL SORBS3 ITGA1 TLN1 NEB","c2.cp"
"REACTOME_FATTY_ACID_TRIACYLGLYCEROL_AND_KETONE_BODY_METABOLISM",0.213073170731707,0.817274822503055,0.289858634116639,1.11090754798781,1091,163,"APOA2 ABCA1 GPAM TBL1X CTGF CYP7A1 YAP1 AGT PPARA DGAT2 WWTR1 CPT2 PLIN2 ELOVL2 SLC25A20 TXNRD1 HADHB TEAD3 LPIN1 TEAD1 APOA1 TEAD4 LPIN3 ME1 CPT1A DECR1 ANGPTL4 HADHA GPD2 ELOVL7 G0S2 ACOX1 APOA5 ACACB HADH ACADS ABCB4 LPIN2 ACADL HSD17B12 ACSL1 AGPAT5 CD36 PRKAG2 PEX11A SREBF1 RXRA NCOA2 ACSL5 ELOVL5","c2.cp"
"REACTOME_IL_3_5_AND_GM_CSF_SIGNALING",0.200079239302694,0.817274822503055,0.38993123465502,1.18741550952027,1009,40,"IL2RA IL2RG CSF2RB IL2RB HCK YES1 VAV1 LYN SYK STAT5A PTPN6 FYN CSF2RA RAPGEF1 SHC1 STAT5B HRAS INPPL1 CBL JAK1 CRK IL3RA","c2.cp"
"REACTOME_INCRETIN_SYNTHESIS_SECRETION_AND_INACTIVATION",0.201702817757957,0.817274822503055,-0.497907340834671,-1.2321068551025,994,16,"GNG13 GRP DPP4 PCSK1","c2.cp"
"REACTOME_INHIBITION_OF_VOLTAGE_GATED_CA2_CHANNELS_VIA_GBETA_GAMMA_SUBUNITS",0.202689143086494,0.817274822503055,-0.443348006865969,-1.21172896705521,1009,24,"KCNJ6 KCNJ3 GABBR2 GNG2 KCNJ9 GNG3 KCNJ12","c2.cp"
"REACTOME_INTRINSIC_PATHWAY",0.214271234542875,0.817274822503055,-0.492032761441434,-1.21756979379082,1056,16,"KNG1","c2.cp"
